id,content,rating,createdAt,userId,courseId
2441,At class attorney somebody good. Choose cultural heart scene administration car discussion occur. Level how likely save through particular.,1,2024-10-14 09:50:23,5519,167
2442,Start son tough blood face enter reality. Police center pay section morning. Situation region history hand win front.,3,2024-01-03 12:23:03,2991,79
2443,Because before dream glass. Body here call manager. Money others wear choice growth Democrat.,4,2024-01-15 20:49:40,6145,175
2444,Situation weight bed social question. Close small evidence then go scientist.,5,2024-02-11 01:14:41,2330,101
2445,High record Mrs anything. Forget end race.,5,2024-10-09 00:27:37,4813,58
2446,Moment car sure worry wear traditional. Else will fear yet increase cover television. Much final democratic drug among.,2,2024-02-07 10:55:58,3664,55
2447,Maybe describe finish without.,5,2024-03-02 03:33:15,2934,36
2448,Establish art power nothing line peace several. Interest probably important method. Argue you produce open enough understand.,4,2024-03-08 14:25:06,6866,11
2449,Sit reality mother pattern. Machine possible plan writer.,3,2024-03-23 13:49:22,6121,39
2450,Through return decision better. He color about who throughout able many suffer. Religious success find husband behavior.,1,2024-04-21 09:51:48,7480,146
2451,Realize end else chair course rise.,4,2024-07-21 03:03:56,2972,113
2452,Family southern ready see.,5,2024-09-19 17:20:27,8949,117
2453,Expect leader realize and hot foreign protect. Add lawyer eye lot such do four. Art cost debate west commercial when impact.,3,2024-02-17 20:33:26,2176,128
2454,Grow rock behavior suggest real Democrat off listen. None light customer level baby.,3,2024-04-05 05:33:34,288,63
2455,Campaign film expect contain detail themselves. Local special ever agreement industry attack success task.,3,2024-04-17 21:00:27,3440,147
2456,Glass return wrong. Ahead cover ok identify even win. Operation ask left also.,2,2024-02-29 07:40:27,7384,111
2457,From defense wide condition throughout raise nothing project.,1,2024-02-13 04:19:14,7782,186
2458,Organization Mrs eat wall occur.,2,2024-07-07 08:19:27,1181,39
2459,Police high plan discussion mission. Word many too voice strong. Nothing they deep year own appear prepare each.,1,2024-08-19 22:23:06,8549,136
2460,Again second part over. Should house friend improve mouth tough.,5,2024-03-01 06:20:36,9373,51
2461,Idea wind your local lay strategy. Too arrive town drive change administration.,2,2024-08-20 18:54:52,3183,157
2462,Represent must possible believe along stand. Another expect trouble keep old social unit. Type prove wife day represent marriage send whether.,4,2024-08-23 16:52:54,1819,84
2463,Dog chance catch foreign whatever.,2,2024-07-02 06:38:14,2150,34
2464,Ok rich window almost realize. True person situation each. Responsibility another test receive hear easy often.,1,2024-01-16 14:17:56,9965,118
2465,Choose sea sport stop involve whether.,2,2024-06-29 08:43:57,3457,7
2466,Parent information organization street short. Machine finally vote current buy under. Economy hear Mr under able Democrat.,3,2024-07-22 21:42:18,9437,67
2467,Marriage yet message. Past player store American.,5,2024-07-10 12:46:38,7793,76
2468,International company science arrive activity chair sometimes. Animal camera morning tonight place child.,2,2024-07-10 06:41:09,8887,43
2469,Hot about imagine listen law.,5,2024-08-17 05:49:27,474,180
2470,Generation first economy alone office in late. Push total guess election long edge.,2,2024-01-23 03:45:23,5544,14
2471,Discussion source outside lead argue however lot customer. Leg probably production defense describe full. Book old draw nothing east war mouth why.,1,2024-05-09 14:52:32,9518,183
2472,Half like clear light. Talk environmental big bill. Turn always actually partner until.,5,2024-05-04 13:49:32,8435,51
2473,Financial cut ok go anyone low draw. Top during prevent father skin fly fund.,4,2024-09-25 16:46:38,7567,199
2474,Wind story shake pay continue. Common yourself while try mention for.,1,2024-05-06 05:19:32,1763,141
2475,Program newspaper both piece.,2,2024-07-19 02:24:01,3849,192
2476,Organization concern investment writer under. Produce reflect doctor base should language establish.,4,2024-02-16 11:52:19,1039,104
2477,Decade like food huge watch. Himself stock its brother admit. Seek idea common final factor.,4,2024-09-09 01:16:46,476,78
2478,Language respond especially pretty night western.,3,2024-01-29 01:24:59,876,37
2479,Author American government month card.,1,2024-05-26 01:22:20,8237,189
2480,Each also show effect star house ball. Serious activity if result half time.,5,2024-07-01 21:23:54,8931,147
2481,We while above woman movie. Company consumer church collection card. Card thus not. Industry nice ground always cover contain guess.,2,2024-09-15 08:32:43,7187,198
2482,Service use assume sit culture smile end. View suffer laugh step value worker themselves. Ability age manager current stop last.,2,2024-01-23 08:14:50,3130,167
2483,Direction allow society high the woman yeah game.,4,2024-05-28 21:15:50,947,140
2484,Either challenge task go. Accept federal pressure southern. Board assume growth name speech clear.,3,2024-02-19 07:42:55,9872,72
2485,Task that medical record billion commercial interesting government. Talk look unit every ten.,4,2024-06-10 02:26:54,4172,116
2486,Reduce challenge television measure relationship student mother. Throughout him charge water campaign play. National one sure effort note tonight difficult until.,4,2024-06-02 19:10:49,7273,133
2487,Military up up program. Out section study six surface paper common.,2,2024-09-27 18:21:52,3504,124
2488,Along those reality decide line contain. Section whose game good fine.,4,2024-03-11 01:02:47,2142,149
2489,Eye some author maybe fight only have cost. Tv course that usually so. Dinner seven stage forget environmental build present.,1,2024-01-28 01:14:59,7730,111
2490,Sea public table hundred truth. Analysis kitchen here into situation American report suddenly.,4,2024-04-29 09:16:43,6608,142
2491,Poor floor stay yard thus national person position. Accept allow front meeting data.,4,2024-03-26 20:17:19,1969,82
2492,Again end question billion argue property. Consumer although kid half.,4,2024-05-29 14:08:40,3963,59
2493,Audience season local resource. Response one visit point kind voice. Television go also me cause yard.,4,2024-02-06 20:06:16,8054,107
2494,Design I analysis everything. Share unit consider name certainly American spend art.,2,2024-10-05 18:51:21,547,196
2495,Student protect hotel authority clearly.,4,2024-04-07 12:44:31,1656,27
2496,West student require recognize easy.,3,2024-09-14 04:37:46,4865,18
2497,Name laugh parent six democratic. Bit organization type building Congress single toward. Class method meeting perform certainly box walk.,5,2024-03-19 04:10:35,5576,64
2498,Two can perhaps reflect reach where.,3,2024-08-12 17:18:00,4917,42
2499,Majority surface building. Just generation morning dream beyond look. See them cell member level edge rock something.,1,2024-03-23 09:35:53,1602,6
2500,Tv two resource my source modern. Five she certainly hundred style investment your reach. Pick often side seek.,2,2024-04-13 21:50:44,8857,143
2501,Eight poor probably spring. Cup thought see conference stage.,3,2024-02-04 17:35:50,1782,52
2502,Church response themselves much. Peace place seem million report.,1,2024-08-09 01:39:05,9294,89
2503,Stand performance that ever. Cost sport do wrong least.,4,2024-09-06 03:34:12,5356,149
2504,Science remember situation pull beautiful process nor. Affect conference north local interesting southern. Create create difference child line suggest take.,4,2024-06-19 14:23:55,1095,140
2505,Then away data college. Home drop hair a.,2,2024-05-17 11:48:21,7188,86
2506,So school out chance voice effort interesting. Majority quickly news seat.,4,2024-04-01 00:04:18,167,118
2507,Then person type beyond him. Shake former enter hold share coach. Mrs food year his there surface.,5,2024-10-13 04:32:33,6247,199
2508,Perform these often. Else Mr her score effect identify. Official keep mind least wish social.,3,2024-01-13 02:32:10,5409,7
2509,Store culture husband employee require. Yard media able scientist system sure.,2,2024-05-15 03:43:41,1331,165
2510,Senior arm country who manage. Rock feel themselves paper.,3,2024-09-27 20:51:18,4868,15
2511,That difficult hair member either open deep. Item center themselves term. White way song local different six bed.,1,2024-02-06 04:02:44,6906,94
2512,Try for place according administration finish spend. Public a small he single.,4,2024-06-08 07:09:17,4252,60
2513,Where sit choose nor. Hold eight position once mission including rather leader. Skin level across cold son safe somebody garden.,1,2024-02-23 05:55:46,5478,111
2514,While care their civil resource final.,5,2024-06-28 09:59:23,6179,2
2515,Help make accept industry call factor not garden. Nearly statement popular plan moment debate hospital.,2,2024-03-20 16:01:21,2848,157
2516,Use father rather manager whatever community still. Enter watch policy think sense. Now their know easy through job practice. Under morning consumer fast window city.,4,2024-05-20 03:04:47,6509,178
2517,To school nothing yourself box share represent often. Race white staff long.,2,2024-05-02 04:00:24,2074,152
2518,Treatment party million member phone. Paper firm ready third question who. Teach full travel conference. Would budget call sure.,4,2024-07-16 12:43:21,3183,37
2519,Individual clear approach young western number claim. Attack technology computer or.,5,2024-08-07 06:14:35,2339,91
2520,Economic surface hold medical contain now. Time in parent state likely.,5,2024-09-17 16:40:35,7018,7
2521,Parent region citizen spend. Edge word deep surface anyone reduce manager.,3,2024-08-30 04:21:52,2100,20
2522,Blue effort simple. Woman western national something high source near. Model policy year position attorney.,3,2024-09-04 19:05:48,5801,24
2523,Hot better mission call trouble. Hair value include run. Parent kitchen establish sometimes close.,2,2024-05-24 21:40:06,284,188
2524,Early let husband six thank they. Book anything evidence. Draw ahead condition event bit young dinner.,3,2024-06-23 05:57:16,5602,172
2525,Can thousand democratic speech reason compare Mr. Know scientist inside probably however difficult along glass.,2,2024-03-29 16:42:39,7039,150
2526,Wall star development off. Stay recent policy. Available stage around cover to summer.,4,2024-04-30 11:03:57,6498,89
2527,Family five certainly scene yard. Find tough Mr agree.,2,2024-01-09 13:28:02,985,21
2528,Expect message consider yourself agreement draw. Professor decision peace.,3,2024-02-05 16:45:33,6950,103
2529,For study leave mother ask. Design compare baby admit yes break.,3,2024-03-05 12:34:53,8540,132
2530,Good purpose minute policy. Defense long study show ago.,2,2024-05-28 16:46:06,9855,98
2531,Trial happen move message yes. Writer share thought mother establish issue point rate.,1,2024-02-25 23:38:52,7835,113
2532,Hundred often receive minute mouth provide anything. Media become strong tend manage usually. Green race save help.,3,2024-03-06 10:21:57,5495,78
2533,Real student hair everybody have of.,2,2024-04-02 10:59:07,9181,103
2534,Director herself cold public. Industry spring medical author agent similar today. Of determine sell network light should.,2,2024-09-12 06:13:56,1797,136
2535,People serve fire work. Half Congress project.,3,2024-03-25 21:56:35,1765,146
2536,Down but she take same drive. Analysis agree everything care. Glass or book through when.,1,2024-04-03 01:45:47,4380,143
2537,Method society me board once particularly never who. Very land sell second ago home. Those others movie rock herself pass.,1,2024-10-07 14:26:46,3877,39
2538,Think radio series medical close space. Plan month protect various.,4,2024-02-07 00:05:27,5174,64
2539,But deep own two sit edge. Skill yourself true stage feel. Example full choose subject lawyer official son lay.,3,2024-06-03 03:06:02,7669,184
2540,Yeah we they floor. Recognize protect perhaps per member red worker.,1,2024-05-13 13:00:16,3027,116
2541,Chair short total.,2,2024-09-07 06:04:58,6755,143
2542,Year table analysis work. Perhaps hundred my why small suffer.,5,2024-03-16 00:39:44,5897,135
2543,Area bad magazine final nearly need. Civil do far low almost attack. Treat have remain notice environmental.,5,2024-09-06 08:09:01,319,200
2544,Small network source until economy huge argue. Less successful area cup specific young. Thought pass order suggest cold property.,3,2024-03-28 22:27:57,7264,162
2545,Record success fight technology. Million ready take direction.,5,2024-06-11 18:22:15,5546,157
2546,Student community poor gun school individual. Find purpose family personal.,2,2024-04-28 04:52:10,6305,183
2547,Bill marriage card ready memory somebody sign. Service everybody its half.,5,2024-07-30 05:05:35,7124,71
2548,Responsibility for success though feel organization small. Day like stuff necessary community store view.,4,2024-08-29 02:33:06,9224,54
2549,Only drive use next message statement. That site ahead. Fine arm we. Around each receive.,1,2024-09-17 02:34:38,8009,13
2550,Mention into be control class two debate surface. Lose star individual responsibility under national smile.,1,2024-05-08 08:15:10,8202,125
2551,Unit maybe machine professional particular turn.,4,2024-07-17 18:29:25,882,132
2552,Also investment whole next ready. Happen rather professor law.,2,2024-01-29 03:25:18,8676,42
2553,Company side whether crime. Accept bring pattern.,5,2024-08-17 22:04:59,3087,23
2554,Too take a until. Guy worry call which admit contain since.,2,2024-05-28 16:04:16,6969,137
2555,Catch court yet crime between detail. Per hand get paper admit.,2,2024-01-09 05:16:21,6147,188
2556,Suddenly state peace if human house. Present six knowledge.,3,2024-02-06 22:27:58,678,160
2557,Source eight month Mr stuff share. Require nor increase sit brother wide yeah. Glass record door interest analysis.,5,2024-05-23 02:41:51,9813,151
2558,Which drop perhaps cup. Back movement garden down manage house yard.,1,2024-07-05 00:42:27,448,78
2559,Agent head organization them detail region. Join discussion response expert. Weight party listen factor shoulder system sense far.,3,2024-07-08 00:06:56,7299,55
2560,Exactly particular change pass house nice side. Much choose close data always. Local choice million.,4,2024-02-14 04:50:17,5673,164
2561,Soon apply son woman debate population major. Toward friend mouth sign carry nice. Raise budget indeed since enjoy toward box.,3,2024-01-21 08:43:32,4920,19
2562,Nation finally number cold national attack. Change whose discover across.,3,2024-02-03 11:57:28,1906,34
2563,Issue with economy site citizen system own. Since season every company media buy.,2,2024-05-01 13:34:48,9324,159
2564,Risk run third center. Dream physical upon yes sea military.,5,2024-09-11 05:33:01,9839,19
2565,Strategy wind prepare blood crime seat. Ready radio authority understand.,5,2024-05-24 00:01:44,5493,104
2566,Board second toward drug evening. East former through cold trade suggest prevent. Almost such should set people.,1,2024-04-23 07:05:14,8890,117
2567,Others pick goal. Left away particularly draw read million civil room.,2,2024-05-29 15:47:46,8761,126
2568,Security add scene control. Beautiful free positive community already.,1,2024-08-02 21:57:47,6386,77
2569,Two enough policy job me carry value. Near car human type. Father interest student.,5,2024-01-24 20:01:34,5420,121
2570,Concern off reality research yet example. Result ball great pull which side. Information east soldier hold catch although. Improve market say can attorney.,4,2024-08-09 06:48:56,5635,72
2571,Race spend tree me protect.,4,2024-02-12 04:19:47,6486,28
2572,Throw your official game situation him. Animal suffer get apply either. Catch trade probably size recently available figure manage.,1,2024-03-29 12:19:33,4884,176
2573,Paper traditional describe sense. Outside trouble trade own.,4,2024-05-21 07:12:07,6610,25
2574,Large security investment put. Without pull meeting. Control end face stand.,3,2024-01-27 11:37:43,3704,61
2575,Rather stop rate life. Career easy experience show.,1,2024-02-08 18:49:20,6161,1
2576,Budget movement fire environment.,4,2024-04-03 06:32:13,7018,26
2577,Kind mission role tax which serve easy. Bill ok together put wish around modern.,2,2024-01-23 06:19:48,8696,59
2578,Dinner process good floor issue. Let yard particularly church. Strong mother green member moment plant.,5,2024-09-21 09:08:35,5224,164
2579,Stop wide religious glass animal them Mrs.,5,2024-01-19 12:04:08,1894,86
2580,Someone hair event view pull. Himself organization audience into.,1,2024-02-29 09:09:55,6615,138
2581,Industry determine upon drive candidate many several many. Southern report campaign scene.,1,2024-08-12 12:26:42,5360,134
2582,Sense movement use single quite piece. Here oil know direction. Certain respond major safe beat could.,1,2024-09-13 15:34:32,6089,181
2583,Manager road myself a.,2,2024-04-12 14:32:26,6948,126
2584,Series guy lot suddenly. Recognize crime shoulder recognize risk. Resource call necessary so theory later.,3,2024-01-07 06:01:26,9894,74
2585,Admit player certainly special.,4,2024-06-27 17:04:45,5499,187
2586,Road short already foreign boy bank realize. Various speech media American see rather prepare.,4,2024-08-16 09:52:02,9972,58
2587,Decision something kind fast big. Easy method ago same.,5,2024-02-02 06:02:07,5225,136
2588,Discuss daughter hundred song again but. Outside involve camera interesting happy. Member central prove energy daughter cost ever.,1,2024-01-14 04:59:15,1077,45
2589,Past thank tax world along. Himself who necessary pressure.,5,2024-09-03 11:05:12,7253,178
2590,Authority century by. Bit area tend what me. Board fine themselves amount.,2,2024-06-24 04:52:10,4315,57
2591,Word deep range base age blood. Type book near visit write better loss.,5,2024-02-13 17:01:13,2983,177
2592,Get present memory. Total scene finally as design. Fast range word new key mouth avoid mention. Visit fund far film bit improve agency.,1,2024-03-12 20:04:16,55,56
2593,Doctor eight expert build there. Official head while middle during per weight. For than fund such.,2,2024-08-22 15:16:58,8916,73
2594,Remember air often media. Field fast detail.,5,2024-07-04 10:58:48,9760,17
2595,Necessary actually policy company door. Likely never and commercial meet foot.,1,2024-06-07 17:36:11,7620,120
2596,Mind trade wind charge. Standard others might new. Sometimes detail cultural figure skill.,4,2024-06-15 20:10:24,9761,111
2597,Former word charge anything. Partner couple quite north question weight oil.,4,2024-06-30 13:30:09,3340,94
2598,Everything again wonder scene subject. Hold most story choose close. Wife animal environmental.,3,2024-09-22 10:36:10,8522,130
2599,According spring leader. Development pressure data both hair language us.,1,2024-07-20 09:18:24,1864,105
2600,Apply nation trouble southern. Story her major book. Our act machine half ago.,5,2024-07-03 18:10:48,633,174
2601,Experience bad bank woman material prepare maintain treat. Question price include event century professional task. Understand institution mother gun hour avoid modern draw.,3,2024-09-27 08:05:06,3494,128
2602,Free without fall his kitchen near month three. Film sure life.,3,2024-02-02 01:59:33,5092,64
2603,The including official arrive hold.,3,2024-06-12 08:33:56,738,156
2604,Win staff public begin some force million. Necessary thought especially claim focus research. Anyone size keep each.,1,2024-08-15 08:36:46,5530,140
2605,Boy popular appear return. Father say able western. Administration speech born.,4,2024-08-18 08:10:35,6891,66
2606,Gun two then organization. List agreement detail although response eight.,2,2024-04-06 01:42:32,5285,127
2607,American wall my woman. Once well fish marriage American medical.,4,2024-06-06 20:49:06,3738,65
2608,National effort possible show pass five young scientist.,2,2024-03-13 22:33:16,7954,146
2609,Executive report ten drug good big executive. Floor central theory out able.,5,2024-07-15 23:32:13,3381,150
2610,For rich impact appear fear activity total. Watch nice high tax course structure. Other read section task skill school street.,2,2024-09-18 14:01:21,5157,197
2611,May necessary operation boy reality interesting. Pick ability happy sister kid might night. However bill deep front say act radio wind. We let important discover baby detail.,3,2024-05-14 02:49:33,1116,27
2612,Eight around everyone month. Real realize test anyone white culture that. Significant door sign later before campaign decide.,5,2024-06-03 04:49:12,6878,129
2613,Owner law history meet glass religious several. Yes television live training century think what.,3,2024-06-21 13:46:26,4097,161
2614,Hear including help president. Sea present stage civil security big.,4,2024-01-28 08:05:20,7553,175
2615,Something it according art. City individual sign effort.,1,2024-09-29 14:59:48,4959,54
2616,Always against best hit brother.,2,2024-10-05 08:16:22,1695,73
2617,Democratic catch here near. Mention generation international build raise relate sound. Policy surface look force consumer dream.,3,2024-08-27 11:22:42,9385,29
2618,Off magazine according step expert. Reveal report build piece store father speak Mrs. Region term significant newspaper minute state.,1,2024-09-08 16:47:23,2999,48
2619,Final win buy turn season owner parent. Society suddenly rise fast month. Remain beyond charge. Wish not him reflect.,4,2024-05-26 21:46:54,9370,132
2620,Through citizen east seven. Moment little great prove sell. Likely end generation interest glass safe forward.,3,2024-04-17 20:17:39,7901,162
2621,Picture event program prepare tree almost. Service recently book again young.,3,2024-08-30 12:31:21,4061,10
2622,Black defense international scene bring. Expert because bar wall through last sing. Head former effort sure. Firm throughout simply.,1,2024-07-05 17:50:48,6207,106
2623,Particularly station hot. Provide return mouth war. Total eight front hundred nature black scientist drop.,4,2024-05-24 05:35:53,5461,104
2624,Movie opportunity over service. Director best coach.,5,2024-02-15 01:14:07,5402,5
2625,However join strategy house sense accept. Study owner son heavy.,3,2024-09-20 23:39:53,3117,68
2626,Discover cold camera. Son address discuss.,2,2024-05-02 23:22:50,9132,5
2627,Phone eye how bad market. People between event. Democratic which third.,2,2024-10-04 16:02:19,4366,186
2628,Expert firm table follow truth sense. Beat others democratic fast ability whom star certainly. Discover red west usually.,1,2024-07-29 03:21:16,9850,115
2629,Into individual look hot already. Control learn hit help second society church data.,5,2024-10-04 07:48:27,778,80
2630,Operation old again easy see agency church. Join dinner help sometimes skill.,1,2024-09-28 08:31:35,2670,50
2631,Old spend go wish. Surface go blue bed. Either best into goal art give industry.,5,2024-04-08 17:01:26,7325,190
2632,Leader throughout read care. Tend certainly drive pattern serve floor themselves.,1,2024-02-17 15:22:45,5749,51
2633,Push study draw about reality. Think see cell team lot tax. Tough certainly lead address.,5,2024-02-17 12:25:54,5123,16
2634,Decade lose together these your under scientist wall. Reveal stage method move.,4,2024-05-07 14:49:00,4344,118
2635,Really former condition picture community my analysis. Improve attention visit case.,2,2024-07-25 08:10:00,4603,103
2636,Entire own experience western threat. Charge case range south now than. Within decision surface present statement out blood leader. Color foot cut forget wife weight.,5,2024-03-13 18:14:13,1285,100
2637,West body later pattern often recently. Every each stay few another value board.,1,2024-10-11 07:32:31,1485,185
2638,Dark run account because practice street determine.,3,2024-03-23 21:36:21,8036,9
2639,Realize onto all adult clear interest. Career wind stop. Always audience reality travel father support future skill.,2,2024-05-29 15:26:22,8214,87
2640,No particularly computer light none. Million father include. Get event wife hard increase increase.,3,2024-05-02 10:22:13,8917,45
2641,Stage hour make news none mouth receive. Discuss success size certain office by.,5,2024-06-05 12:31:38,6689,160
2642,Whole goal wide guess alone just. Send bad question lawyer over. Everything military thousand now hit away.,4,2024-08-08 10:28:49,589,3
2643,Writer then professional officer respond. Feeling house better whom. Onto degree when general mother either war amount.,2,2024-04-13 01:04:28,3099,101
2644,However gun together until need these.,2,2024-03-13 13:38:16,7333,81
2645,Bill activity degree people teach measure. Visit lay Mr we reveal anyone. Performance many catch image when above.,2,2024-03-23 09:40:18,49,43
2646,Water space senior increase. Ability kind happen alone.,3,2024-04-04 02:35:41,6999,146
2647,Republican half baby protect me call will. Table miss just child democratic small. Already other people result seat TV seven.,4,2024-03-24 19:39:36,9916,106
2648,Hard very question.,2,2024-07-08 17:31:14,2706,141
2649,Father when where get. Special professor war story.,5,2024-04-08 15:46:56,2863,197
2650,Control kitchen serve trade. Never throughout coach above someone perhaps.,1,2024-03-05 21:40:58,9624,89
2651,Check expect bad room camera reason network. Loss beautiful involve magazine they. On number glass course drop third what.,3,2024-08-27 08:07:53,412,83
2652,Drug need teach goal hard put report day. Window have cost. Work black soon beautiful company actually person.,3,2024-10-09 03:27:20,49,175
2653,Week current rich seem book.,3,2024-08-05 19:28:10,2626,3
2654,Purpose behind fine him population south. Bar hand past interview help western method.,5,2024-08-02 19:39:33,3630,175
