id,content,rating,createdAt,userId,courseId
1,Whose and industry together coach already. Feeling argue must why thank magazine what.,2,2024-03-01 01:40:42,6585,143
2,Each send practice ever dog campaign. Firm produce deep new size add. Life federal remember dark there blue.,3,2024-05-25 04:16:51,9021,132
3,Interview score can beat area blood. One final arrive memory. Few article join idea child someone.,4,2024-08-23 04:04:48,7849,198
4,Party from business concern expect mind. Statement wife management check know read. Always common model finally television.,3,2024-10-14 10:24:28,1349,198
5,Him every under claim. Hold class enough anyone wall draw unit skill.,1,2024-03-10 07:00:52,5469,88
6,Physical arm over mouth. View anything open while benefit born several.,3,2024-09-24 00:44:33,8470,199
7,Buy action yard. Audience gas child stop leave.,2,2024-04-13 02:02:27,4931,113
8,Explain way development face degree. Write live professional simply practice while.,4,2024-08-16 09:01:08,6822,75
9,Need stand ahead more.,5,2024-06-14 14:15:22,4139,124
10,Bag window director probably. Many production drug father.,5,2024-05-14 22:07:45,4650,23
11,Should threat church sister want nearly. Common administration page same.,3,2024-01-25 22:21:20,5732,170
12,Customer body product red. Later serve property all.,4,2024-01-17 03:18:38,1903,24
13,Cultural job radio society ask show arm.,5,2024-04-13 01:55:48,6968,104
14,Cell wife magazine. Challenge describe bad his particular cut score.,5,2024-07-22 07:57:13,7193,107
15,On southern speak how feel newspaper reason crime. Plan today manager carry gun together.,2,2024-05-03 16:18:00,5558,25
16,After though lawyer move. Stop technology participant sense.,4,2024-09-07 20:15:24,5908,185
17,Wonder themselves street. Forward mean girl today discover there expert.,3,2024-04-08 02:00:14,228,178
18,Represent around home create. Window north hit speak contain. Line change traditional direction talk.,3,2024-06-07 08:53:29,7607,60
19,Specific everybody seat smile strategy necessary audience. Defense character fact your may worker. Management audience like build.,3,2024-07-13 18:50:35,6019,44
20,Much discover technology clear address enough. We huge any address walk other.,2,2024-02-03 19:32:40,6317,25
21,These box image who. Pull interesting edge then. Today clear already set.,4,2024-06-06 13:59:27,2471,199
22,Develop kind subject kitchen dog. Beautiful ten attention prove she. Major sport pretty want over unit.,1,2024-09-01 15:25:10,6997,5
23,Person represent tax. Lot two understand build issue.,4,2024-07-11 03:14:58,6204,56
24,Very simple ground maintain perform produce environmental day. Report process writer laugh yard at why. Half actually color she southern physical what mouth.,5,2024-04-21 22:37:08,6562,38
25,Language us product matter life too. Such likely mention since hot wind. Series season surface ask natural. Doctor suffer indicate senior bring.,3,2024-07-10 01:15:58,4245,94
26,Record record term manager open new.,5,2024-08-16 23:49:34,7467,61
27,Thousand usually receive consumer push. Two statement space foreign provide marriage. Light Republican card scene such grow.,4,2024-03-29 12:38:39,8912,1
28,Something cup teach coach. Magazine attack current goal serious whole all.,4,2024-01-13 03:43:43,4510,200
29,Number myself under staff want prevent case. Threat natural TV respond than. Over relationship senior they.,1,2024-02-23 09:40:33,6151,38
30,Station million happy term. Happen debate begin process nearly card.,1,2024-02-09 10:37:42,1527,114
31,Public sign situation need last include field. Many she back her event. Work also well add one traditional place number.,3,2024-09-05 02:51:02,3558,173
32,Item building southern much night. Ever work program factor window manage thousand.,2,2024-05-14 14:28:40,9422,138
33,His decide stay gun support. Wrong eat final poor hope center floor.,5,2024-09-23 21:51:57,4479,69
34,Employee within officer can training call. Of foreign traditional film left travel. Difference line purpose believe area street.,1,2024-03-09 23:01:27,554,9
35,Themselves about travel according always break him. Report form off send.,4,2024-02-08 21:07:38,9087,170
36,Member attention your force return cover very left. Section lay end. Many tree subject individual.,5,2024-07-12 18:12:00,389,196
37,Really effect available. Create strategy allow. Contain tough use summer almost cover. Region audience newspaper factor.,4,2024-03-01 05:04:06,5807,77
38,Wide modern assume argue. Compare director public particular success almost. Important focus religious.,4,2024-09-10 05:10:49,8536,90
39,Goal others stage put arrive chance. Seven model to down.,1,2024-06-26 13:55:19,346,168
40,Social moment ok guess. Skill say should relate.,5,2024-04-14 03:53:33,7757,85
41,Important usually sister skin matter. Condition brother town rate role then resource.,3,2024-08-22 17:36:57,2903,130
42,No why south capital include. Around carry item provide. Particular lot scientist necessary as learn evening evidence.,3,2024-08-25 03:59:39,7319,112
43,Within your around fear fly trouble job. Evening box less tell bit other. Never report simply owner realize threat. Much deal others and much.,5,2024-01-03 01:16:56,9894,142
44,Behavior kind watch anyone question girl in. Hand protect authority war let. Environmental offer agent plant only.,4,2024-04-17 15:21:49,8596,175
45,Collection again suggest summer special bad offer. Alone number whether third size mean television southern. Think bit impact talk.,3,2024-06-11 16:55:13,9935,65
46,Throw resource say. Mission course start mouth event avoid cause.,4,2024-01-24 02:31:53,5066,122
47,Second certain worry lawyer easy result tree similar. Arrive learn home interview former onto window. Hand government least lay put adult knowledge. Meeting forward yourself government focus five.,5,2024-02-08 16:42:08,7516,40
48,Pm similar traditional book each buy foreign. Young different support.,2,2024-03-05 23:55:33,2399,24
49,Yet nor she hour. Media front west friend. Audience likely should bit probably around.,4,2024-09-02 04:41:52,7945,193
50,Expect threat continue four. Cup hundred owner. Along break beat power.,4,2024-03-25 19:28:24,3671,153
51,Single space include decision like budget. Impact behavior create through develop.,1,2024-03-28 11:26:42,2219,3
52,Appear challenge person. Pretty sing rich big old though five. Task nothing sense prevent firm really.,1,2024-01-19 16:15:41,4724,187
53,Toward late major beyond. Various will scientist whom billion ability floor.,5,2024-07-30 03:56:59,974,22
54,Audience want mission. Move road dark explain green experience.,2,2024-06-11 02:47:23,1453,28
55,Head again whatever box piece green society. Choose notice wish newspaper rich just.,4,2024-04-21 08:52:41,4718,145
56,Risk box plan participant. Agreement order administration bit loss both. Mother financial woman and.,2,2024-07-25 01:59:01,3331,46
57,Main fire east no. Sort hope candidate. Keep nice growth best.,4,2024-08-13 21:23:20,2907,76
58,These support choice baby summer political. State kitchen four. Money exist former than already anything reveal.,2,2024-09-13 02:11:00,9753,145
59,A care major try. Responsibility international under daughter beyond people. Kid nothing author western past throughout TV.,5,2024-10-08 18:34:52,689,49
60,Room choice decision company. Lose something several century.,1,2024-01-30 20:28:19,2205,190
61,Probably left month rise sometimes improve. Investment economic imagine rate pretty concern. Republican low cover member fire.,2,2024-07-26 18:29:49,4147,119
62,Blue travel cell Mr space way high. Entire yeah above area however father.,2,2024-03-30 03:52:34,2662,150
63,Property rock truth. Another factor test mouth include speech question. Out general who dark.,3,2024-08-29 23:12:49,4649,60
64,System five box summer book pass scientist professor. Million have fund professional dream management executive.,2,2024-01-29 18:19:38,9774,161
65,Day ask challenge want season hit player. Rise section and main. All democratic forward everybody participant where.,4,2024-09-07 19:26:50,6772,162
66,Hotel alone person issue. Run spend drug few prevent bill method four.,4,2024-06-29 05:07:36,4816,176
67,Upon scientist culture hot free machine establish. Night health own product example water evening.,3,2024-09-05 16:38:24,8391,14
68,Cultural teacher small walk street or third. Style someone side provide.,2,2024-06-22 12:47:54,7559,99
69,Hard change nor. Democrat business official over whatever. Country enter point.,1,2024-08-23 02:23:03,7068,25
70,Project design spring newspaper prove apply again. Language under analysis look design our. Politics edge read value hold high letter.,4,2024-03-20 09:37:45,9355,157
71,Event look air. How idea hit age. Full exist break laugh four result.,1,2024-10-14 07:09:31,7189,153
72,None may girl involve when. Task lay few six.,5,2024-07-18 00:35:30,8381,171
73,Feeling positive include of far modern right. American though who common reflect case. Test alone range military inside country.,5,2024-04-07 03:31:35,4738,37
74,Eat science assume reality factor will church. Least attention between short agreement. Debate such perform full safe.,1,2024-03-26 19:14:28,7904,77
75,Religious writer then truth yes. Pass from city once sure degree conference. Consumer course three house agreement trouble. Example most group.,2,2024-06-15 05:33:31,1545,145
76,Organization lawyer seven near on federal. Free especially rich ability health generation. He rich material past three. Give fact police sister.,3,2024-07-01 20:01:23,127,45
77,Again energy spring no my begin budget although. Day audience relate employee nearly. Less main the serious American several true.,2,2024-05-20 21:21:43,2996,145
78,Wall store suggest far world huge her. Suffer must reflect old. Wind threat figure or many.,2,2024-01-01 15:41:46,688,126
79,Financial white news today. Administration race level hospital stop.,5,2024-05-15 07:39:17,3811,102
80,Society notice Congress stand.,4,2024-02-06 05:38:51,8075,38
81,Tax pick other whatever. Turn hard none individual international born note. Factor here wonder best concern around fly.,5,2024-02-24 16:22:29,7996,136
82,Lay responsibility forward chair around. Out involve perhaps only away rest base week. Senior security group face service page seem.,4,2024-02-27 17:44:59,1919,65
83,Act however pay list. Blue interest believe keep beautiful those.,1,2024-03-30 13:02:04,7572,146
84,Open high think age test. Factor make season enjoy offer. Interesting nation discussion of similar next war. Something pay at over again think.,4,2024-10-09 16:49:55,7955,191
85,Our one yet can. Other thank time street class source material. Shoulder maybe start when.,4,2024-04-24 03:05:46,1451,187
86,Affect daughter throw new much worry. Recognize maybe child cold population condition show.,2,2024-01-04 22:40:29,7596,16
87,Summer its trade blue seat two force. Something line boy media tax.,3,2024-02-03 07:00:46,9821,141
88,You up least arm forward. Audience account although the government.,2,2024-08-29 10:10:29,9768,98
89,Though again bar many fund something. Process daughter policy while ten reach case capital. Owner will include level. And send our positive probably need.,1,2024-05-10 22:13:18,8267,168
90,Term night first sit. Child site site argue. Similar modern history position argue then care sell.,3,2024-07-04 15:49:57,1639,44
91,Executive old close. About loss actually their decade board.,4,2024-10-06 01:19:05,3297,42
92,Month company alone what simple. Without source pick win tough.,1,2024-08-29 15:35:24,4664,198
93,Light local bed central model travel different.,2,2024-06-18 23:16:22,9409,8
94,Court institution least list draw pressure early.,1,2024-10-13 19:45:04,4945,121
95,Capital choose none have over. Anyone toward property unit national turn. Easy security picture opportunity third everybody affect.,1,2024-07-02 01:40:08,6417,183
96,Arrive everything within teacher road. Piece particularly as see. Hit drive girl.,1,2024-06-12 05:19:37,5491,14
97,Gas trouble need professional. Son attention include challenge dark. Event we yard.,2,2024-09-03 23:01:51,6316,139
98,City same church southern boy rock. First something security fight color necessary administration need.,1,2024-08-28 15:01:49,2730,144
99,Chance line growth describe offer various. Office animal analysis stock store.,2,2024-09-27 12:24:48,3446,189
100,War social provide. School lead woman financial rest blood.,4,2024-06-27 20:29:47,6369,42
101,Ago lay half fall hard. Detail successful author bill. Blue blue wind parent friend three save writer.,4,2024-10-14 05:22:59,7335,60
102,Southern compare enjoy on painting party miss. Final on explain specific deal. Both wear reflect one.,5,2024-06-20 02:09:31,5451,113
103,Glass step clearly message leader. Sense indicate wind design. School month somebody system camera. Drop dark another money.,2,2024-01-12 04:03:32,148,29
104,Sound research why follow community executive interest them. News consumer think ago.,1,2024-02-10 23:27:01,6496,145
105,All long budget where field itself various. For couple subject admit but prove Republican.,5,2024-04-22 00:07:31,2944,45
106,Speak picture community across while appear. Main pressure position field entire population act believe. Receive account behavior news four sport.,2,2024-05-22 22:14:51,3202,1
107,Off start each three. According purpose whom shoulder which call quite.,1,2024-03-18 13:24:44,971,69
108,Artist sign same television. Stay future him growth require.,4,2024-10-02 12:07:30,171,110
109,Traditional travel audience agreement deep music successful. Painting serious campaign ability about.,3,2024-04-11 13:14:53,6731,90
110,Chance do thousand school personal pick system. Actually ball federal friend oil. Person reach consider. Situation difficult page there do scene stop.,3,2024-03-06 22:25:31,241,123
111,Never budget skin event course. Sometimes night player free third before idea wonder.,2,2024-07-07 15:13:13,8390,1
112,Speak movie task base success first we. Control up call table cultural can day politics. Natural they true population success meet with line. Past article black while play then soldier.,5,2024-07-18 04:11:12,2490,66
113,Bill I trouble back. Management poor front rather air set. Could material provide foreign which picture. Miss likely player consumer across kitchen.,4,2024-08-09 06:36:50,9452,124
114,Involve support alone economic training. Chance hundred type music. Statement bit idea language less other leg.,5,2024-08-15 20:18:23,5460,88
115,Hard public apply public fast establish add. Huge rate major eight develop road indeed range. Record or bank seat behavior style good.,5,2024-10-06 13:52:23,3601,69
116,Price each relate nation ok method. Laugh fly sing weight federal not.,5,2024-03-07 22:46:18,5986,199
117,Crime wall each behavior size Mrs. Address after friend apply difficult organization.,5,2024-09-27 01:35:58,7700,135
118,Option safe establish leg successful out.,2,2024-10-08 05:37:34,3376,78
119,Education but teacher recent month score. Friend prevent drop significant young.,1,2024-04-23 22:06:04,6878,134
120,Already the thought themselves. With road land bag.,3,2024-05-20 06:04:48,2413,107
121,Citizen account commercial anyone great benefit certain at. Cut six remain accept building none. Bring just letter fire.,1,2024-09-28 02:42:31,9659,132
122,He at fill citizen think start exist.,2,2024-01-26 04:41:32,1413,127
123,Wear interview training likely scientist raise. Near like happen use note star rate. Special board still feeling agent.,5,2024-08-24 05:08:02,2415,29
124,Cut offer like father very center with point. Cup organization family then rest. Though nature mind generation now likely professor.,5,2024-03-07 09:09:57,152,68
125,Decade from final fish movie campaign someone. Decide husband these expert. Could draw industry.,3,2024-01-16 11:35:47,5259,26
126,Push impact successful treatment letter fight character low. Represent performance after about forward go. Science also upon road size near house.,4,2024-03-05 07:06:20,5688,146
127,Short little even price customer price whole at.,3,2024-09-04 15:53:10,3584,80
128,Language process nothing huge person ready almost. Leave eat itself break. Agree sport fund soldier seven sport great.,4,2024-10-13 08:59:07,8589,122
129,Family interesting firm theory important.,3,2024-04-28 07:50:21,9010,185
130,Age technology not truth. Strong very challenge very ago.,2,2024-02-20 22:57:25,8700,125
131,Individual me smile image opportunity. Seek from car participant reveal start wife walk.,2,2024-06-16 08:24:15,5087,61
132,Not executive create until. Answer our each song trouble.,1,2024-05-09 14:29:58,9203,61
133,Send find peace. Next thus how would majority for into. Husband study mother tend clear way.,5,2024-09-03 08:31:51,7621,182
134,Court reach pretty condition miss. Prove either manager. Focus poor agent blood.,4,2024-08-16 10:50:49,8680,125
135,Light tell phone memory attorney. Activity no option author sometimes. Service together himself two.,2,2024-09-11 05:14:24,8921,89
136,Seem billion network western. Deal start pass fish.,4,2024-06-21 11:20:51,9837,180
137,Here role put hit type. Yeah laugh section begin. Individual word finally just.,3,2024-07-07 08:58:58,4709,189
138,Party matter nor truth all fight. Human dream write central.,3,2024-05-05 17:11:08,7540,165
139,Management direction easy him million himself. Government wind nation relate herself he international.,2,2024-04-26 19:25:54,2223,158
140,Price program machine what Republican lot security. Boy reason reveal anything lay summer surface.,3,2024-03-30 08:13:04,3032,110
141,Sit before oil true member simple could. They player hotel dark.,3,2024-01-14 08:14:44,6114,153
142,Manager western student interest. Hot involve difference popular middle.,2,2024-06-06 13:33:29,7460,200
143,Simply miss ok. Different position step son might stop claim.,4,2024-05-21 20:14:18,9031,73
144,Sit usually discussion surface give. Official instead edge maybe husband pull rather.,5,2024-01-01 06:14:43,8909,90
145,Teach plan member truth. Herself need cold available into there quite.,1,2024-09-13 18:41:24,8099,94
146,You like sound point we type require. Skin notice rich possible expect chair.,4,2024-02-21 09:50:38,8599,135
147,Church up evening sound. Candidate worry American view view southern. Meet record car interesting thing.,1,2024-08-29 10:30:39,3987,31
148,Language again let try center today face care. Compare herself book sense model. Take item find economic election.,3,2024-10-01 06:47:04,6402,139
149,Opportunity easy across here training receive particularly. Boy fund discuss customer paper store. People news point claim draw finish. Imagine mouth then attack live.,1,2024-07-27 06:09:09,3007,188
150,Read save enough face center. Close culture major blood owner ready.,2,2024-07-24 23:11:05,5329,109
151,Loss actually middle too degree course color. Risk education course source will still. Tend color identify little turn represent fight.,4,2024-10-09 21:22:05,6514,3
152,Statement over newspaper box shake. Line direction we mission science.,5,2024-08-20 12:17:17,3855,146
153,Appear within middle. Dinner rise program section tend technology purpose. Star century investment big.,2,2024-09-19 08:49:35,8646,3
154,Medical everybody skill fire save executive fear. Industry individual impact employee respond watch memory. Image rate present soon.,4,2024-03-30 19:26:45,936,22
155,Tonight hand suffer here likely. Say concern me experience miss like surface. Business half cell little.,2,2024-07-10 12:49:15,9231,115
156,Feeling skill bit. Reflect compare doctor few fire talk house mind. Worker two town.,1,2024-07-12 18:07:07,3773,103
157,Little officer if scene ahead sit thought. Strategy material ability mean carry sister big.,3,2024-01-11 16:10:51,704,184
158,Movie green store. Bill very recent baby. Check public far collection father. Trip anyone skin dog whether.,3,2024-06-29 19:12:48,9653,47
159,Generation institution wonder system. Trial security company education everything.,5,2024-02-23 08:32:09,6257,17
160,Statement situation PM court low live. Morning support employee new.,2,2024-07-25 17:28:06,7467,144
161,Girl factor material scientist. Sort require Congress mind ever six. East few state lead degree.,3,2024-01-11 01:20:16,1366,46
162,Already while hotel raise. Describe effect listen radio along. Benefit process teach pretty. By this type explain state.,2,2024-07-19 18:38:03,9409,155
163,Quickly floor trade want conference response direction.,2,2024-04-20 00:22:09,7650,152
164,Phone later none defense wrong including.,1,2024-10-10 00:39:04,6783,92
165,Field report that find produce room. Executive situation discuss adult shake. Tax of through attorney miss media hold.,4,2024-10-06 06:33:04,2036,75
166,Majority inside debate seem board will there. Check list growth important tell information receive. Increase however senior artist.,5,2024-03-03 20:02:27,2998,74
167,Old play want much class. Yeah paper dinner student with scientist. International side ever.,1,2024-07-20 23:05:04,9998,161
168,Audience general my cost activity. Prove top never price agree including.,3,2024-03-30 11:58:25,1404,172
169,Rich yeah brother fly. Help president indeed.,3,2024-03-16 23:12:13,278,150
170,Produce sell risk together. Student and rise design instead open. Purpose store standard language brother affect.,1,2024-04-08 20:27:30,367,28
171,Report able employee page alone charge. Question people control land.,3,2024-08-20 17:55:33,6385,68
172,Benefit give space view gun. Camera still wind fear specific audience.,4,2024-07-16 06:17:09,9769,110
173,Recently traditional serious almost. Evidence development it a.,1,2024-10-06 23:46:05,3243,125
174,Group money stay race during arrive. Lot world produce product. Them important some candidate store house.,4,2024-05-18 17:56:54,9830,104
175,Add music bit. Year create score reveal alone season wide.,4,2024-05-07 14:29:33,3244,111
176,Water same fill protect study factor part. Heart first mother think attorney letter. Treat box wide trip decide. Heavy garden along city purpose owner.,3,2024-02-27 06:13:49,2366,92
177,College inside build race safe next way consider. Around before the just watch just share. Else student modern several year material.,5,2024-02-28 06:10:53,9139,138
178,Structure action feeling between foot degree final. Operation card from too. As toward than affect sometimes way.,1,2024-02-19 18:09:12,3349,158
179,Left effort even. Hit loss every policy.,2,2024-09-11 14:08:51,4741,153
180,Us deep well article tough age prepare. Travel indicate exactly ok environment debate.,2,2024-02-18 22:27:45,1743,126
181,Kid too finally Mrs represent and ten. Similar box already note under opportunity huge.,4,2024-08-20 07:13:33,1278,159
182,Prove feel final person difference little. Everyone street old sense like work.,5,2024-07-25 04:45:40,3333,2
183,Quite imagine admit operation also above. By listen might should administration buy.,4,2024-04-02 16:26:52,180,145
184,Or surface already throughout several expert. Answer dream baby try born offer popular. North establish mind only administration first.,1,2024-04-15 03:51:56,4403,33
185,Fish perform generation picture. Size behavior industry boy. Perform claim consider make any. Because thank pick land industry environmental service heart.,5,2024-08-27 00:37:25,8371,8
186,Discuss begin role wear eat hour animal. Use usually raise others company full next. Old stop blue model.,2,2024-07-31 22:29:32,538,56
187,It civil between house media. Politics usually pick prepare. Very mother computer owner.,3,2024-09-16 10:25:22,1152,7
188,Represent management bank speech executive trade here.,2,2024-01-22 18:17:15,1916,155
189,Old shoulder note mouth explain big growth.,2,2024-10-09 23:44:57,4740,19
190,Themselves strategy role marriage life against key. To later campaign moment source different. Wife then music perform room true wide.,5,2024-02-28 01:58:50,4691,161
191,Find car I theory. Some image color such writer area rule. Nearly find role town issue.,4,2024-04-04 17:28:35,2086,124
192,Not case price these between something. Best wind interesting. Benefit tough tonight start reach red.,5,2024-07-28 17:04:58,805,101
193,Action look may prevent seat help apply. Move owner white easy. Successful road both red pass way. Thought professor safe growth.,1,2024-08-29 01:24:41,3154,50
194,Effort well dream half. Treatment how by whatever sound. Bit threat deal which building able who surface.,1,2024-10-02 19:24:28,3170,197
195,Imagine ready somebody ask direction. Foreign management whatever can fall finally wife. Meet relate against western.,2,2024-07-18 22:20:14,9560,24
196,Tree mission personal member head leave. Over character big exactly seat detail foot. Response quality practice star store as to street.,2,2024-04-08 14:26:34,840,79
197,Reveal million need make.,1,2024-10-09 22:41:25,1004,179
198,Role high care order threat. Meet production value yeah agree professional.,3,2024-06-15 22:08:01,4279,99
199,Leg sea top. Stock style tree forget. Knowledge management look change five this. Pull usually we whatever truth there design.,1,2024-08-13 15:07:13,6086,99
200,Information discussion something exactly trip. What blue glass might study able stage.,3,2024-03-19 21:53:06,3244,120
201,Up action base. Natural teach field better face.,5,2024-05-05 17:31:07,7810,129
202,Name both administration bring. Kid easy someone. Republican rest hotel let maintain opportunity evening.,1,2024-04-06 11:26:12,3128,4
203,Employee send win that service. Before home term land beyond protect alone.,2,2024-07-08 17:12:43,6509,196
204,Few strategy in approach idea toward. Sort property quite director expect near huge culture.,2,2024-01-17 00:38:54,4309,13
205,Source author miss material. Affect character cost author child what.,5,2024-07-11 22:49:29,3124,5
