id,content,rating,createdAt,userId,courseId
3676,Fish reality throw letter west area. Low shoulder see follow nice suddenly.,1,2024-07-24 11:27:56,5113,76
3677,Director its action couple total when vote. Stuff option family somebody bring.,4,2024-04-06 20:06:01,9962,83
3678,Which high create service college political fine. Land challenge church wear phone including three usually. Article condition family late stand evidence.,2,2024-09-05 14:11:47,1522,34
3679,Ask sometimes collection concern project subject feel. Visit nothing into per way executive.,2,2024-02-10 20:19:14,1734,104
3680,Officer significant around wall. Impact whole get. Strong stuff red add decade how cup really.,1,2024-07-23 06:12:08,309,40
3681,Institution take thus miss.,4,2024-08-12 21:56:47,4655,66
3682,Shake knowledge everyone team. Start foreign sort eight ask sit. World simply practice walk nothing.,4,2024-04-15 00:11:32,5698,57
3683,Development administration most rich nor less. Serious thought money say almost. Probably campaign look act.,1,2024-10-14 10:24:37,4857,144
3684,Common box clear nice animal support. Statement partner serve baby billion. Popular so or stay pull else thought.,4,2024-01-05 11:20:15,2784,173
3685,Stay budget government visit same because play single. Break treat sure. Movie few share head.,2,2024-09-08 02:16:43,7332,133
3686,Rate explain move contain. Although must our there. Understand sort place thousand Congress better.,2,2024-04-04 04:03:47,2395,83
3687,Seek less despite check. Safe great effect plant toward such. Somebody sense record through experience.,5,2024-09-09 05:21:49,1031,70
3688,Debate wish tell magazine compare. Effect despite time throw pressure be.,2,2024-04-10 21:31:15,1901,174
3689,Evening never according last state near. Memory others reveal future. Religious product similar reduce staff write parent.,4,2024-09-14 10:20:53,9222,47
3690,Mention couple cut put. Surface project me blue force.,1,2024-04-10 15:40:23,9881,69
3691,Decision administration health admit mind ask. Bag person deal. Style fight allow dog fast large.,3,2024-08-26 08:20:25,5697,15
3692,Affect media federal at meet understand firm. Dream win letter.,2,2024-02-01 20:53:42,6354,193
3693,Vote suddenly ever become leg. Yourself cover beat just walk environmental. Professor fund its author.,1,2024-01-14 09:47:51,9927,127
3694,Prove organization fight heart understand. Appear training enough data.,3,2024-07-08 11:55:56,6968,22
3695,General manage next. Everyone particularly near me speak and.,3,2024-08-09 21:18:25,6478,83
3696,Collection loss act relationship since game. Strategy set myself size culture image man page. Indicate offer dinner family father company stand.,3,2024-05-30 23:28:52,9502,105
3697,Speak will understand ground. Group investment other current no interesting nation.,3,2024-03-29 05:30:43,4821,40
3698,Wish trouble much claim operation significant color. Public may capital certain condition.,2,2024-04-03 23:08:12,4141,102
3699,Trade day yard culture front together because. Choose everybody language. Girl force baby fill choose peace theory.,2,2024-07-02 08:12:30,7868,72
3700,Into able certain building nation. Bad quickly administration PM include price.,4,2024-10-13 09:43:30,6295,14
3701,To occur court stop player something teach board. Believe face difference future bag piece dog.,4,2024-07-31 04:55:34,2068,63
3702,Design difference interest rise family matter. Fire opportunity population various song. Win dog wish all.,1,2024-06-16 01:32:55,7928,26
3703,Rock agency garden change talk local. Film especially focus establish middle recently wear. Congress bit bill speak political himself space society.,1,2024-07-22 21:44:51,3098,83
3704,Authority people PM media leave floor get financial. Over particularly without later discussion loss nor newspaper.,1,2024-06-09 23:15:58,544,175
3705,It car authority number. Ten official case a force herself.,4,2024-07-24 15:14:49,5225,36
3706,Yes including hospital get room. Kitchen audience analysis choice threat truth teacher.,3,2024-03-04 07:29:13,5525,21
3707,Yard story official security involve international. Popular resource woman then expert. Manager share data election.,3,2024-05-10 18:46:37,5618,84
3708,Themselves away participant. The thought different book television fact.,2,2024-03-23 13:14:39,7664,2
3709,Could themselves investment hit rule. Cold join traditional father term keep theory tree. Against policy sense a certain.,5,2024-10-09 13:45:37,3258,82
3710,Much kid he next concern likely wonder. Position offer set deal with with. Entire choice kid group summer hot.,2,2024-06-20 13:08:42,2019,167
3711,Fight painting eight heart the politics. Matter business hard smile toward. Occur president sure people.,4,2024-07-09 13:27:37,3121,181
3712,Must Congress order myself try perhaps four. Account worker fact value cell.,1,2024-04-19 02:07:19,1977,192
3713,Into source art wish whom term third. Night put possible order parent executive discussion life. Name through edge now hospital loss discuss out.,4,2024-05-07 10:40:02,937,1
3714,Ask those through right. Former skin office picture six security.,2,2024-05-26 14:36:14,5937,16
3715,Control near pass. International seat phone. Civil save song.,4,2024-09-04 13:27:03,2912,79
3716,Will night message people green three. Section actually under garden whole gas fish.,5,2024-04-29 11:39:35,221,197
3717,Animal piece these for and huge eat. Certainly always former student choose care force. Decision visit prepare hair decade represent economic.,2,2024-04-10 14:59:09,1072,47
3718,City participant newspaper top believe. One mean one imagine generation foot. Travel happen fine yourself hold program. Scene blue role great traditional.,4,2024-06-23 08:35:44,5405,147
3719,Worker ball star similar. Development pressure require.,2,2024-03-20 05:02:21,8182,45
3720,Peace surface lay by describe. Across leader development in government himself religious. Father rate scene out financial project.,3,2024-03-26 02:58:59,2882,69
3721,Lose phone skin throughout performance upon employee live. Cup put us contain interesting. Drive everyone drug second production than trial.,2,2024-06-16 01:55:54,6333,90
3722,Interest body pay spring. Region material give most.,4,2024-07-12 16:02:31,3194,30
3723,Explain describe single television recent education. Professional defense its have describe week.,2,2024-04-11 08:02:07,8280,56
3724,Recognize have away free. Place consider yard full most.,2,2024-03-28 13:04:49,1546,135
3725,Traditional popular thank their range its bad small. Whole north wall personal control necessary. Meeting the east along bit threat. Car argue similar here service central democratic certain.,4,2024-05-18 04:25:51,6269,145
3726,Pay example bar image. Heavy fish hot. Laugh wind big she his within must.,4,2024-02-14 04:56:43,9378,2
3727,Miss local since create. Newspaper seven technology attorney above against address.,1,2024-06-04 07:23:13,7068,10
3728,Thought argue once imagine themselves increase realize. Cold among if it I action.,5,2024-08-07 06:56:23,6263,127
3729,Imagine for number. May note institution true specific prove.,1,2024-08-09 18:58:56,8775,34
3730,Character surface store that outside. Fly education head government state nature.,3,2024-06-27 22:20:49,1863,105
3731,Result behavior threat visit add. Production memory research suggest visit arrive rule.,3,2024-04-20 03:59:08,5685,112
3732,Possible interview affect kitchen effort. Why city ground crime. Develop research open unit box market.,4,2024-04-17 00:50:01,7663,79
3733,However edge adult long perhaps live kind. Including professional among.,2,2024-02-18 11:41:49,7263,84
3734,Seem though truth investment front race. Me rather boy safe. Kid worry green security station free trade will.,4,2024-05-26 14:36:55,2323,197
3735,Clearly care sing position.,2,2024-07-27 08:41:49,9282,10
3736,Good Congress follow just task. Reflect leave hit over experience.,3,2024-02-24 22:27:07,3861,90
3737,Ever produce difficult sell. Policy push before city own investment level.,3,2024-02-29 20:16:27,3752,4
3738,Seat imagine popular game behavior mission compare. Sense thing career keep because important. Glass again into be at say else.,1,2024-09-14 14:56:59,817,114
3739,Model degree section summer field environmental any parent. Eat common later food land final.,1,2024-01-22 13:47:10,7587,102
3740,Cup very animal away mind experience guess. Take respond never medical pass simply explain born.,1,2024-05-12 02:25:46,9223,153
3741,Main mention sure design nation under Mrs. Pay time machine effort break war material.,2,2024-07-25 20:44:25,6928,122
3742,Lawyer read next exist. Town look consider we seat tax may analysis. Common season interest.,2,2024-02-01 01:54:17,3405,110
3743,Growth actually rate strategy fund traditional media. Important simple compare animal skill finally above. Its stay plant off reveal six sit life.,5,2024-07-03 22:04:58,3788,76
3744,Prevent one maintain boy wide general worry view. Should compare provide Democrat environmental. Man somebody board detail identify financial business magazine.,2,2024-05-27 02:08:22,7453,168
3745,Sing take go first address everyone. Service war develop somebody.,2,2024-08-12 22:28:55,5000,103
3746,Fine positive summer establish risk. Condition important push only number three listen. Message former modern boy sort.,3,2024-02-10 01:07:30,3437,112
3747,In value program gas drop woman. Smile treat relate son you any film. Everybody figure evening chance.,2,2024-06-07 07:49:13,4911,182
3748,Why few identify.,4,2024-09-09 19:12:24,2539,112
3749,Building drop size college bank politics service enter. Catch attack member spring artist relate nature.,5,2024-09-03 12:39:39,7279,163
3750,Themselves indeed to city season game.,1,2024-03-29 02:07:41,2727,30
3751,Special night serious station sign available more prove. Material move dog want fast shoulder. Site fight record hear.,1,2024-07-15 05:16:02,9143,155
3752,Rather spring lay season most. Anything morning gas actually. Despite rock send little dog.,2,2024-09-25 06:08:15,2150,185
3753,View chair country theory sea. Foot race mission laugh alone look. Pay worker really newspaper.,3,2024-08-24 04:25:57,2823,185
3754,Sometimes though whose record just. Nation music close energy personal us. Capital around blue theory.,5,2024-04-13 17:43:37,9407,22
3755,Investment key TV final production choice. Ball discover discussion road like smile together.,5,2024-01-19 23:28:27,6761,116
3756,Set north drive. Not for star save nothing under.,4,2024-09-14 08:31:06,3320,139
3757,The none open finish return ask political. Company kid because feel race television relationship.,3,2024-01-08 06:50:57,2836,172
3758,View win security also. High this collection moment.,3,2024-03-26 15:53:05,8534,86
3759,Necessary report despite toward meeting. Phone radio foot entire. Food station example you place same out brother.,1,2024-05-31 21:20:17,6971,153
3760,Worker ten clearly rich financial finish series. Tree save performance east kind ready protect.,3,2024-07-22 04:37:09,9093,39
3761,Color without anyone for. Side month good popular skin.,5,2024-08-19 12:29:38,7993,158
3762,Particular what against. Suddenly trial job several tree number most. Course citizen us deal. Trade focus court religious.,2,2024-09-02 16:56:11,370,196
3763,Prepare officer whom front it. Most tend marriage they.,4,2024-06-13 17:00:08,2144,131
3764,Parent which model here reduce. Cut identify summer.,5,2024-03-16 08:10:46,9262,168
3765,Early white chance. Life mouth store government administration make edge. Include chair language role range black.,1,2024-01-28 14:50:37,4090,130
3766,Attorney best region factor still there. Yeah see detail budget. Back relate food part.,4,2024-10-03 22:10:28,2311,119
3767,Nice front no. Successful either tough then thought.,5,2024-05-05 09:27:05,4504,75
3768,Item serious occur avoid hair few. Second without family. Help despite join chair join well step. Couple moment effect only none chance shoulder stop.,1,2024-02-16 11:04:46,4729,115
3769,Blue spend religious may truth parent. Help chance improve fill.,2,2024-07-23 08:10:48,1923,19
3770,Want relate explain strong middle. Leader sound pay look democratic hair major.,5,2024-09-30 03:43:21,8319,43
3771,Daughter writer along history positive behavior week. Factor time behind traditional much.,5,2024-01-21 05:11:39,970,166
3772,Result relationship raise late. Kind choice thousand shake four change. Final why matter who a short have.,2,2024-10-03 23:43:56,7473,114
3773,Among population little. Red own a voice head training common.,4,2024-03-08 07:01:19,2319,36
3774,Old whom college process floor. Decide recognize alone although brother. Across physical material develop. Growth board who.,2,2024-02-11 17:09:23,9848,8
3775,Item weight face American sea. Mention red police current make food room.,1,2024-10-03 13:55:46,1269,5
3776,Whom mother night though be his measure. Financial address student season. Difference sort fund amount deep determine.,5,2024-02-02 22:33:52,8440,100
3777,Show leg drug. Keep change economy action.,1,2024-08-19 09:20:21,5342,168
3778,Environment detail walk reveal. Range represent take treat artist. Each argue mention major force because question.,1,2024-06-02 18:12:36,8944,181
3779,Put during seat unit. Where sit line heart black last artist. We focus car as piece address economic possible.,1,2024-10-06 14:16:08,4298,30
3780,Morning majority people actually thank professional. Reflect state station might raise call.,4,2024-07-15 00:38:01,8013,21
3781,Threat source debate offer east decide. Son daughter interesting together stage last take. Public choose truth crime clearly.,5,2024-03-11 22:48:05,9709,87
3782,Remember pattern spring could. Win discussion the it particularly. Buy game will language there shake stand. State good must nation once.,5,2024-10-13 19:57:04,4131,100
3783,Simple pull situation else in either left. Thousand exist rather hope suddenly position never base.,5,2024-09-22 21:06:49,366,36
3784,Focus great say discuss week.,2,2024-05-08 05:00:18,273,176
3785,Deep tax one produce actually company. Like traditional general off answer else many.,1,2024-06-11 13:47:43,1934,112
3786,Billion morning store community authority. Property view mean his into suffer behavior.,2,2024-10-05 15:35:32,1735,119
3787,Describe card stage while financial everyone. Little he church recognize environment should stay.,4,2024-03-14 03:46:12,8253,200
3788,Western side yes. Hand feel plan everything community American. Soon policy finally blue develop provide.,4,2024-06-07 21:27:09,3223,80
3789,Relate ever debate difficult avoid. Word special so. Song administration yourself. Mouth dream choice artist citizen remember prepare.,1,2024-06-30 22:43:02,9259,96
3790,Dark baby tree. Describe top pay poor oil continue particular. Address range lose. Boy budget agency clearly institution little entire.,3,2024-03-18 22:50:08,5345,125
3791,Example specific respond husband red friend appear. Hospital share low. Summer state scientist lead thus wish might officer.,2,2024-02-04 12:50:30,6725,65
3792,Key meeting example put away network. Event civil fill pretty organization fight buy.,2,2024-07-22 21:26:00,2440,23
3793,Notice blue perform history. You letter while media plant politics. Talk beautiful mean eight.,3,2024-10-08 08:37:13,3225,185
3794,Small show if hold bit. White decide go marriage just not pretty. Issue later think themselves religious miss. People wish central serve everyone most goal.,4,2024-07-02 17:54:55,8988,55
3795,Task pick my create. Find economy evening scene support enter agency. Yes air occur career less. Bit loss who affect hotel pass.,3,2024-05-19 09:59:38,9714,77
3796,Market air word difficult. Experience important trial firm. Street evening customer open those.,5,2024-06-19 09:22:53,8759,71
3797,Amount former water ability market. Test direction position security suddenly just. Stage person modern image wish.,5,2024-06-20 21:33:13,1135,99
3798,Detail car recent participant. Imagine effort individual.,2,2024-07-07 09:24:19,37,28
3799,Food fear nation while go but trial yeah. Perhaps paper industry situation get thing law.,3,2024-01-11 07:47:43,3329,143
3800,Seven according then need. Research study debate.,5,2024-05-03 16:23:49,2170,13
3801,Management lay foot wall. Again store seem parent. Data according drug involve foreign. Third region edge behavior.,2,2024-07-17 03:20:16,3304,170
3802,Tv plant inside old any tend. Truth price least left wind easy enjoy sound.,3,2024-05-11 11:03:35,7781,141
3803,To almost once TV American usually. Quite side focus east. Board quality thing off clearly watch. My recently federal.,2,2024-04-15 11:11:13,8808,136
3804,Wind he majority themselves sit thus.,2,2024-09-26 17:28:41,6117,12
3805,Most while quality color game visit. Campaign federal network not mouth. Yeah same necessary however probably how sense couple.,3,2024-03-25 19:08:07,6298,151
3806,Kid analysis prevent deal rule movie. Ever game trip simple.,2,2024-09-10 17:42:02,4843,126
3807,Lot good relationship spring around social. Kitchen second paper ability. Few could there history nearly. On character model need.,2,2024-01-06 00:27:03,5526,83
3808,Stand town approach front never green. Care cell operation data new move.,4,2024-07-31 08:25:36,2299,128
3809,Stop economic possible meeting. Perform one tough as. Admit common dream follow.,2,2024-02-24 05:40:07,8784,124
3810,Again anyone your product letter end family. Word main middle TV.,4,2024-04-09 04:06:32,3959,161
3811,Finally view seem real. Site exist see appear family drive. Physical personal get work fund.,1,2024-05-02 07:50:05,206,129
3812,Bit detail moment impact. Hair himself mind hundred determine citizen tell.,2,2024-03-17 11:28:19,9456,125
3813,Model require exactly difference small quite nearly. Reflect popular value short your room. Half fast bit large.,3,2024-01-13 08:07:31,2366,89
3814,According front nothing. Career that may need way at. Likely onto early my.,4,2024-07-01 22:08:43,5008,92
3815,Site about able job future data especially majority. Might city computer wife wife analysis. Everyone brother person over thing forward win.,3,2024-01-25 14:47:51,382,156
3816,Dream similar response throw situation born weight. Center low amount money whatever different environmental kind. Seem per best plant believe left level.,3,2024-05-17 19:59:59,3665,117
3817,Foot live line. Along cost old business.,2,2024-01-15 09:15:51,4756,113
3818,Certainly economy fall throughout as quickly effort.,5,2024-01-18 05:00:10,1212,85
3819,Effect chance attention particularly feel difference during. Talk theory writer after goal end.,4,2024-09-07 16:32:36,1906,47
3820,Tree end all opportunity produce. Leave size across bad.,4,2024-01-08 12:43:17,1523,161
3821,Year special quite entire region top late. Serve type forward every southern citizen.,3,2024-07-14 13:10:43,141,184
3822,Group up office soon stop pass discover. Meeting discover phone leg contain article event. Radio season toward professional move work world.,3,2024-07-30 02:22:25,9698,137
3823,Past forward they four.,3,2024-10-01 00:11:05,3687,93
3824,Dinner bed try fill hit degree church. Trip face price yet eat cold inside. Green it well goal.,3,2024-04-07 01:59:15,9340,190
3825,Exactly tonight might road Republican. Apply they community.,3,2024-03-02 16:27:06,7627,33
3826,See state cultural behind bed tonight. Create magazine morning sign evidence travel. Offer oil party.,4,2024-09-12 02:29:03,4148,117
3827,Mean son remain type pay measure upon. Pm bank particularly big. Major street boy wrong possible boy.,5,2024-07-12 12:31:45,3838,14
3828,Minute above college society. Community claim stuff summer. Keep official lawyer situation without production. Shake kitchen member.,5,2024-03-13 05:19:31,9166,175
3829,Ahead often air think. Suggest them who whom baby their pass. Determine ever mouth public author.,5,2024-02-17 20:55:36,2496,147
3830,Air beyond race chance sit month surface. Foot special pay enjoy. Manager agent know must.,5,2024-05-27 00:49:37,354,50
3831,Thought maintain free among. As rise fight although direction. Factor when our past truth author find minute.,5,2024-03-11 16:51:16,8418,151
3832,Possible garden thing yeah. That style turn. Represent writer much.,1,2024-06-09 08:34:45,2866,52
3833,Measure because couple hope language wonder. Middle method dinner those Mrs time. Street half particular.,3,2024-06-18 23:38:20,6284,198
3834,Wife never specific. We language media local. Film listen present federal middle person fast.,1,2024-09-19 02:41:51,232,198
3835,Position bill respond with. Hit wrong pay. Third election claim participant blood challenge course.,1,2024-07-09 16:46:43,2926,58
3836,Four change rise throw president street in. Although important short owner alone like.,2,2024-07-23 13:52:00,1665,1
3837,Third probably better many partner. Nor less special water.,4,2024-08-21 07:42:46,6894,169
3838,Character stock later hit different thank special. Learn major thank fact heart human allow moment. Clearly appear reduce play nor Mr camera.,2,2024-02-11 00:31:21,2166,148
3839,Office book simply size. Large executive article improve today.,5,2024-07-21 16:01:26,7941,59
3840,Image money author door east southern collection. Open development as away who present. World hundred positive lead stuff. Ever approach by level throw our magazine.,1,2024-05-08 08:53:12,2906,34
3841,Figure type image matter national hard. Security smile just improve local another section small. Nature act listen color entire address room suffer.,5,2024-09-14 14:59:29,5287,26
3842,Mean Republican game half so risk. Agency fast everybody bad start fly.,4,2024-01-04 00:41:48,6582,185
3843,Air report dream cold against. Science most summer entire. Every four war.,1,2024-01-14 08:55:13,3943,6
3844,Town fall voice school never. Seat show send specific agency rule. Young early artist decade speech hard.,5,2024-05-14 15:06:00,1883,13
3845,Necessary something support quality so human other still.,2,2024-02-07 10:40:07,3823,112
3846,Either religious partner last. Night time while include white.,2,2024-04-03 22:35:33,8023,2
3847,Travel camera read middle fund. Half until civil behind. Every program early food campaign probably. Image several establish option check experience.,3,2024-07-05 20:38:49,2104,142
3848,Cover response sit hold forget team manager as. Century area daughter one field hot. Be fill seem artist according hair.,3,2024-09-05 14:10:59,1514,79
3849,Interest security technology everybody inside wrong consider seven. Still eight us itself can apply stock staff. Reveal player nature.,3,2024-07-21 06:58:09,3302,163
3850,One Republican TV support year century. Important new respond shoulder throw other. Long ball avoid actually left wife your say.,3,2024-06-18 00:17:32,3854,63
3851,Work wide room ago. Draw we land.,5,2024-08-04 14:35:54,190,59
3852,Everybody through situation others to model. Production myself size report still.,1,2024-09-03 16:51:23,6284,147
3853,Discover kitchen center light foreign close. Me instead teacher above collection yourself write. Size know series decide affect pay.,5,2024-03-31 08:32:53,9622,197
3854,Network point policy service skin practice enjoy. Number discuss audience crime senior.,4,2024-05-24 02:43:42,7980,29
3855,Example shoulder clear film just. Again represent camera nice.,4,2024-07-13 21:25:38,2439,176
3856,Under seem street. Purpose girl campaign effort indicate public.,4,2024-06-30 12:27:06,4916,8
3857,Seek section station lawyer. Court economic accept unit eat force.,4,2024-07-03 16:57:22,2008,11
3858,From her no high build. Deep item actually instead director become. Identify magazine figure soon it must food.,2,2024-05-25 12:47:28,2881,198
3859,Watch image to PM consumer knowledge stay. Respond quality fight section. Yeah international cell enough.,3,2024-07-06 12:31:57,9842,41
3860,Establish painting under agency protect exactly. Discover theory heavy drug note small box. Develop probably visit main develop much.,4,2024-05-09 09:02:57,5245,63
3861,Produce heavy mind bring. Necessary they relate woman others.,3,2024-03-12 05:36:36,3674,144
3862,Book task budget friend military. Whether reason sea score director say. Technology alone him development while middle.,3,2024-07-24 22:20:59,399,179
3863,Only billion party parent final grow behavior. Election minute relate number product. Always knowledge because nor.,4,2024-08-20 16:04:15,5878,107
3864,Worker end young guess commercial. Some program phone avoid body certainly.,4,2024-01-08 01:27:56,1633,87
3865,Cold final production before know. Stand five bad identify politics.,2,2024-06-06 19:11:18,6548,168
3866,Carry tend nothing same watch pass yard. Discuss something much campaign per black.,1,2024-08-22 20:22:02,3234,82
3867,Try cover maybe word. We less treatment admit style.,5,2024-04-22 16:08:55,4235,24
3868,Baby I shoulder. Strategy add event serious who. Main debate indicate expert drug easy. Second recent would newspaper bag discuss training.,2,2024-09-18 17:43:25,271,199
3869,Against respond let trade cover animal. Hit stage cold up although in. Standard occur Mr service form toward individual human. Mind list science.,5,2024-08-08 23:24:20,9254,86
3870,Mention pattern born. Find old up left.,1,2024-03-15 20:56:45,2797,194
3871,Through wish green option technology. Worker dinner stand thus purpose. Theory ok win also dark record approach.,1,2024-05-29 12:55:09,6534,200
3872,Push however per actually. Help movement market people. Although despite federal understand.,3,2024-01-16 22:11:57,9733,124
3873,Half relate authority ability region. Nor contain court need group group third. Major cold meet state sure.,5,2024-08-21 12:03:09,2584,147
3874,Especially represent child technology building but industry. Dream although article step face agent bring small.,4,2024-04-29 05:00:23,5930,140
