id,content,rating,createdAt,userId,courseId
1233,Far sort Democrat college understand record. Culture step bed. Base test east all.,2,2024-05-10 20:25:59,5408,70
1234,Available until nor. Gun piece generation mean science.,2,2024-09-08 00:32:04,9798,48
1235,Tree management as appear. Need now focus onto. Seat treatment sister pattern bar professional lot. Let chair anyone network detail language.,1,2024-02-23 00:40:23,780,132
1236,Laugh party Mr product win end ever. What four by pick recent.,2,2024-05-07 11:51:06,5043,157
1237,Any local magazine event.,1,2024-03-05 15:13:39,5378,21
1238,Staff similar sport. Church affect right measure represent. Road interview culture represent technology night. Hit why country scene might.,3,2024-03-07 23:04:23,3411,195
1239,Level subject treatment determine mean share day teach. Join life senior company level area visit. Late draw song however range she left design.,1,2024-02-23 14:23:26,5980,82
1240,Tonight check during development everyone into civil. Morning conference town others decide. Church surface century check.,4,2024-08-09 05:30:41,1593,16
1241,Computer although agreement usually.,3,2024-06-07 19:48:16,5938,74
1242,Stay today even former school. Beat her name important with city. Admit the arrive structure if.,1,2024-05-25 10:28:09,4144,23
1243,Performance blue officer former along moment both. Institution product organization remember finish song order. Like source everyone reveal character age agent across.,1,2024-07-12 08:54:33,4050,58
1244,Loss adult its hope their perform paper. Decide smile social career. Heavy sometimes might east.,2,2024-06-06 03:37:44,4925,80
1245,Ahead control type next discuss relationship budget. Available pretty article phone opportunity. Truth with treatment huge win outside argue. Customer green her social.,4,2024-04-23 14:06:44,1368,40
1246,Material write place. Entire even always success analysis knowledge may. Customer surface road hospital company never trip.,1,2024-10-08 02:56:46,6830,133
1247,Manager present early fight region. Send rule of.,1,2024-02-21 22:45:11,2888,87
1248,Tree occur animal manage. Current ask visit shake. Trial activity cultural performance note fast make.,4,2024-06-29 14:20:22,3482,47
1249,Address poor individual expect. Entire we court around hospital what writer. No this national job woman onto mission.,5,2024-03-08 13:11:44,5164,24
1250,Happy money project sport section specific for.,4,2024-04-01 21:31:44,272,59
1251,Budget similar animal hard nearly government certainly. Rate director energy trip go.,2,2024-05-08 23:32:11,8459,4
1252,How when great enjoy market let meet. North firm decide my cultural church. Customer material responsibility town cup. Fill director picture heart continue office argue different.,3,2024-05-25 11:44:32,6727,48
1253,Hear talk never direction million fact begin again. Word east model prepare bag. Several tough arrive case argue.,3,2024-06-19 13:54:00,211,68
1254,Store head Mr off. Executive by walk our manage small study anyone. Ago mother look.,1,2024-05-03 23:40:14,2380,96
1255,Goal wish much get or. Throughout American task clear set group third. Win interesting involve view until room.,3,2024-03-14 08:46:20,7844,13
1256,Pull owner paper ball. Top as only open more quality later. Successful important do color would approach.,1,2024-01-16 08:42:55,4556,167
1257,Miss agreement machine somebody world financial community. Whether example stand social. Scene common know dream.,2,2024-08-03 21:58:20,3025,129
1258,Treatment talk would law move page data. Receive environment easy air.,3,2024-06-23 11:46:49,9835,198
1259,Series rock myself box community style. Opportunity past apply image suggest trouble after.,4,2024-08-14 01:58:24,8278,25
1260,Guess even morning political weight. Send above better yet attorney.,5,2024-09-29 06:59:12,3525,123
1261,Strong by pay collection whatever. Everyone many crime term boy at.,4,2024-09-05 21:22:00,403,57
1262,Federal effort know agreement scene every. Exist do management president past.,4,2024-09-10 14:34:04,4555,135
1263,Eye car I large. Something pick benefit skill. Statement describe key.,3,2024-10-07 09:58:02,6157,195
1264,Fast quickly war technology. Film life do.,5,2024-09-03 17:14:35,1545,59
1265,Relate knowledge hold turn professional lay bed. Pm city network what.,2,2024-04-15 23:58:18,9280,102
1266,Energy sell if able public manage debate.,5,2024-09-07 05:04:24,1035,44
1267,Country door send couple ability herself. You rate bag drug.,5,2024-01-24 01:26:51,118,108
1268,Expert decade music into behind public collection. Form sing manage. Play oil whole difference mean anyone. Over woman try pull rather occur population himself.,2,2024-08-06 05:56:22,4803,173
1269,Within none stand amount. Thousand activity eat gun south front phone event.,5,2024-07-15 18:37:08,2369,90
1270,Less success within enjoy she speak. Between something accept else drug attorney fund. Product success among out kitchen security cell.,3,2024-02-27 11:41:39,454,102
1271,Indicate idea that office. Stuff fund so policy.,4,2024-04-23 17:51:54,758,96
1272,Especially specific future wish if agency personal experience. Say moment land thought board surface attorney. Toward put including into cup.,3,2024-09-19 15:11:27,1841,174
1273,Garden next ask if. Instead city cost alone rule.,5,2024-01-31 07:53:47,9403,138
1274,Make eight raise serious. Catch color particularly budget simple according school. Pattern week hundred kid enough.,2,2024-08-04 07:20:47,7470,151
1275,Seem hair thought bank. Style education represent site. Young notice somebody think a hot college.,5,2024-04-13 23:30:56,8774,167
1276,Natural first collection. Husband show like gas follow beyond. Answer quickly responsibility prepare.,2,2024-02-09 15:08:54,9231,20
1277,Kitchen hundred skin rule line father. Book finish world place yet area. Admit bank program appear.,5,2024-06-29 16:17:53,3294,5
1278,Player life position standard up arrive. Lay soldier total green.,2,2024-04-30 11:24:40,2944,71
1279,Moment figure defense chair carry exist. Picture information can TV unit. Probably culture event lawyer.,5,2024-03-01 08:08:19,1104,92
1280,Arm indicate today fact remember seat. Game our power number my light sit hard. Blood stuff happen the bad.,4,2024-08-18 00:20:18,1081,31
1281,Real find health project free almost. Year skin American lead moment.,5,2024-02-01 09:35:31,5636,18
1282,Reduce allow job friend music garden stay hope. That second mouth property night age if long. Study color day most. Policy wish side attorney.,2,2024-05-11 17:36:25,5838,132
1283,Significant box democratic evening want. Middle happen good father.,3,2024-07-18 02:47:52,6938,115
1284,Here someone political student who go. Box lead church nation tend over. Address your change art resource black house plant.,4,2024-05-17 03:49:20,9592,32
1285,Edge rest stuff southern page office. Sport room show.,1,2024-08-15 08:24:36,8104,111
1286,Lose beyond adult fight trouble set. Improve shake standard wife science.,2,2024-02-27 18:36:15,163,84
1287,Finish real near fund floor free military. Evidence food high audience north.,1,2024-03-17 20:53:12,3922,181
1288,Member piece will oil mind international nice walk. Source tough difficult cover but half. Total not hundred behavior.,1,2024-04-09 00:58:56,507,127
1289,Black top future. Enter early pick cultural.,4,2024-04-24 20:24:26,2765,200
1290,Wide wall really economic compare conference.,1,2024-01-08 13:57:31,9223,122
1291,Determine live gas may show be window.,3,2024-09-18 22:21:07,9923,46
1292,Company particularly born realize piece red picture. Fight organization effect power. Development manage affect face magazine push choose.,3,2024-02-10 21:19:07,139,12
1293,Ready star security reflect what. Personal night guess after campaign key activity. Special alone when involve here particular.,2,2024-06-12 01:01:00,8058,62
1294,Car represent social relationship. Several low plant artist two north.,1,2024-05-12 02:29:46,1291,159
1295,Share staff own case along line television. Some leader federal executive standard return green. It event hour unit plan just treatment hot.,2,2024-10-03 16:23:16,6072,17
1296,Little game try lot today area. High hard event deal. Glass style party between sense good religious.,5,2024-05-25 22:20:00,2291,68
1297,Task day service finish everyone fine today. Peace number right health effort size.,1,2024-01-13 13:26:44,7486,72
1298,International consumer rest charge. Professional other develop single. Month can none book.,4,2024-07-23 07:36:29,5854,130
1299,Amount question trial level traditional admit picture. Pattern despite commercial kitchen although. Yet try step ok second.,5,2024-08-13 07:59:44,336,145
1300,News guess focus center standard born. Candidate energy commercial another bit. Old behind make much western sit strong. Sense thought store realize there trip save Mr.,4,2024-06-11 18:27:34,8675,166
1301,Authority really leg exactly. Focus must nor situation American evening. Reveal defense over fast him over. Join notice hot quite group size.,5,2024-03-22 04:39:19,2680,59
1302,Lead any skin message back general probably benefit. Health change office compare exactly player.,5,2024-04-27 06:45:20,9233,71
1303,Citizen why financial least. Candidate onto though crime health understand.,3,2024-04-16 22:10:25,3451,151
1304,Born owner sure night agency myself. Should fear evening these in field. Western edge game head add. Occur and everything property.,3,2024-09-17 21:10:24,8393,51
1305,Conference east late service participant. Enough pick friend value officer.,1,2024-07-07 02:15:38,3087,173
1306,Everybody person happy two assume outside. Recent account people board size.,4,2024-07-09 05:58:20,3217,113
1307,Major role whom medical. Along risk radio drug out. Whole run none different.,1,2024-01-27 03:23:04,2874,135
1308,Culture near bed source pay. Both political two. Listen pattern operation look lot throughout operation sense.,4,2024-03-08 09:03:16,3347,174
1309,Oil likely option us painting.,3,2024-08-23 21:02:44,4913,91
1310,Begin network husband industry not risk. Wish media lose particularly.,1,2024-09-09 15:57:03,6488,127
1311,Better reduce safe keep building success special. Watch per risk point note nature campaign color. Newspaper treat to particularly provide weight recent.,2,2024-07-20 00:41:18,1866,15
1312,Statement pull visit herself summer history energy. Nearly understand sound American prove.,5,2024-08-18 08:14:48,8557,56
1313,Travel office board drug partner lead. Air product everyone big I record her.,5,2024-05-23 05:37:32,8498,130
1314,Radio themselves crime tend action fact national. Can statement agency food relationship subject.,5,2024-08-28 11:05:49,7005,157
1315,However their miss Congress try perform.,5,2024-01-13 11:16:31,6243,63
1316,Assume five society present campaign. May social choice spring future far.,4,2024-06-27 23:39:01,8708,17
1317,Over voice indeed family commercial. Great international grow environmental TV.,2,2024-09-24 22:31:14,722,147
1318,Story do ground hospital. Page level source technology. Whole live agree key specific. Listen medical such recent positive nice arrive.,1,2024-08-12 07:07:23,5853,192
1319,House officer I mention country. Team stay seem father.,4,2024-02-24 00:48:40,2028,80
1320,Late detail record peace run. However special city. Office central him husband test again already.,1,2024-05-13 19:08:52,8324,57
1321,Stage reach high position note. Where than serious officer remain early. Offer data while.,2,2024-01-11 14:08:29,2403,171
1322,Difficult step who issue customer. Laugh field let free pretty where hospital. Behind apply full run ability.,2,2024-10-09 19:01:02,9838,129
1323,Quickly color test safe necessary foreign. Bit reach reflect strong surface increase week stand. Even culture water stuff.,4,2024-07-07 13:55:09,6234,188
1324,Read understand seven strong authority forward. Alone scientist service feel administration identify Mrs send.,5,2024-08-26 00:20:04,9155,7
1325,Central thus personal cultural. Everyone goal house wide actually agreement. Forward why defense plan ago kid agent kitchen.,3,2024-01-29 23:27:42,5417,76
1326,Summer red party prepare reflect total official. Push edge student. Movement return collection campaign affect.,3,2024-04-07 02:18:07,7232,99
1327,Administration land really town bag. Enjoy article truth nature assume. Husband although agree shoulder education.,4,2024-07-20 01:34:36,7052,92
1328,Another be test probably. Fish campaign give spend.,3,2024-07-28 00:28:01,3864,124
1329,Serious huge purpose life statement. Rise decision different get wrong according.,2,2024-08-30 19:43:57,7368,32
1330,Cut decade fear style culture television each phone. Listen off nor thing learn treatment top.,3,2024-06-26 12:41:29,4193,199
1331,Position student effect child success trial perform.,2,2024-09-01 02:03:33,7606,51
1332,Great daughter late network. Real actually southern society.,1,2024-10-13 15:11:40,7445,145
1333,Same pretty speak may letter. President interesting admit right any job make main. Bag everyone toward learn course research.,4,2024-06-12 21:47:48,2783,17
1334,Chance matter cause respond official. Describe benefit home both. Prove fish feeling fact.,1,2024-08-07 01:00:53,9364,47
1335,Very my other model. Whom start ready old member. Art daughter weight part left with thousand.,4,2024-09-11 01:00:18,5380,124
1336,Side school catch right page. Senior serve heart get international. Method occur class body big ready.,2,2024-08-17 02:36:54,1031,123
1337,Training style sound later machine. Change manager television notice. Rich plan force never minute not ball.,2,2024-02-23 06:13:53,6028,104
1338,Finally maintain difficult society interview reveal no ground. Top enter middle account third law. Food bag team.,3,2024-01-18 13:30:45,1163,181
1339,Purpose color purpose. Serious notice stock pay American teach manage. Recently artist situation reduce. Head religious expert rise view budget where.,4,2024-02-12 01:43:26,662,20
1340,Age story country there party color. Thousand buy recognize say know. Gas often sort.,4,2024-07-04 20:25:36,184,56
1341,Threat watch right official option site. Dark pick song prepare few. But my place series outside region once. Soon draw again.,4,2024-09-09 17:47:29,8721,80
1342,Environmental great improve maybe agent throughout. Just Republican natural.,1,2024-09-16 02:14:51,4822,24
1343,Father challenge south firm. These maintain wrong base during anyone ready clear.,2,2024-04-19 03:52:05,7518,17
1344,Peace wait impact card strategy whom. Full daughter would direction single. Six whatever power arrive civil.,3,2024-08-01 10:09:26,5296,3
1345,Hot cut carry shoulder out one strong indicate. Ready effort prevent simply if support PM. Chair wall boy dinner common.,3,2024-06-30 23:50:30,1672,68
1346,Person author behavior special process agreement become. Hour month health gas.,3,2024-05-16 20:12:28,8153,85
1347,Person peace month investment performance. Second film year fish establish number TV theory. Easy fund wrong a.,1,2024-02-26 11:26:24,821,25
1348,Suggest individual admit system. Born someone response contain up there offer. Inside loss guy thank parent interesting reduce.,5,2024-03-05 06:31:33,4101,147
1349,Cost bill exactly item. Newspaper no point president center community when.,4,2024-02-05 08:39:21,6047,163
1350,Budget TV concern relationship approach. Visit go turn strategy.,3,2024-07-04 16:27:58,7813,106
1351,Walk vote into beyond want person information. Work Congress in group science drop. Other relationship drug year name with effort.,3,2024-04-17 18:07:53,1593,112
1352,Live walk him would onto peace meeting. Worry shoulder consider test professional floor art. Catch stay first film. What authority week truth.,3,2024-05-16 20:18:07,8078,111
1353,Try charge item product. Middle military behavior around behind state carry. Usually with war order president deal.,3,2024-10-05 15:13:14,7140,124
1354,Participant every hold trip shoulder particularly growth. Prevent society young police newspaper order. Pass admit never mission modern.,1,2024-09-07 17:24:15,6089,142
1355,Even tax trip heavy nature ready actually impact. Son sing thing exactly laugh throughout.,3,2024-08-11 12:23:44,8998,148
1356,Police start order watch. Certain page all by official science item.,1,2024-07-31 15:19:39,2107,28
1357,Computer challenge car soon feeling eye hospital. Face ago personal pretty very property rich. Toward a newspaper seat fire.,5,2024-10-02 10:42:14,9949,49
1358,Which ball performance discuss serious spring. Image able summer increase hour standard more return. Year expert result protect couple team meet. Term whom story force natural treatment traditional.,2,2024-08-05 09:58:21,2282,86
1359,Out arrive down reduce home. Region material exist grow writer. Thing decide similar fire training country fish.,5,2024-09-29 20:15:31,6882,108
1360,Receive value throughout test charge network. Little north interview career just culture. National product although inside attention.,2,2024-01-02 13:52:24,4265,139
1361,Boy society pull item. Boy tough nice attention. Fire live world source.,3,2024-04-30 23:00:43,4084,154
1362,Arrive yet surface every center protect need lead. Weight agency particular recently. Base serve media never.,3,2024-04-07 13:33:05,6996,25
1363,Road real list walk on.,5,2024-01-05 14:38:46,3450,28
1364,Few current order gun key. Skin remember deal strategy TV off.,3,2024-02-19 19:45:34,8887,170
1365,Approach PM war thing charge. Reduce defense billion always yes. Modern bit to store information.,3,2024-04-16 04:08:19,2598,32
1366,Throughout husband couple response now chair. Value score ever person study trial model above. Amount fear TV gas would spend however.,5,2024-07-17 16:08:00,2120,145
1367,Else police all themselves. Fall large big view bar a writer. Herself walk close school see offer purpose. Eight music often mind fast short adult.,3,2024-07-15 17:21:11,65,88
1368,Development vote rock share across wait industry. Each issue we imagine worker program. First front leave task PM company.,2,2024-04-27 05:24:24,5008,172
1369,Because story quickly stage suggest. Economy ball some last section range success. Assume practice carry question itself to.,2,2024-04-06 11:06:35,3218,152
1370,Move fish laugh appear including serve onto music. Simply analysis inside type. Speech determine go order expect add offer art.,5,2024-03-29 17:22:33,7123,162
1371,Week billion doctor. Ball side account ok stuff young road.,5,2024-02-27 11:03:20,4334,199
1372,Tough cold television.,5,2024-05-14 10:00:42,9750,60
1373,Marriage more analysis project computer remain number. Analysis strong director grow administration suffer heavy. Improve kind debate author size drive.,1,2024-06-05 12:49:20,4714,170
1374,Job surface action person bill listen why. Unit by soldier girl.,5,2024-05-11 09:01:44,190,108
1375,Grow entire seek lose laugh pay. Improve military catch or course.,1,2024-09-25 13:14:19,826,154
1376,Ability cup PM anyone occur describe.,4,2024-06-30 02:28:57,3019,53
1377,Which seek which though. Politics source statement amount. Religious early level create actually tough.,2,2024-09-25 05:34:33,3563,20
1378,Old thought during whether like party. Themselves eye plant sure.,1,2024-09-30 09:41:30,9365,149
1379,Want entire heavy some age officer perform. Free peace phone particular work discuss.,4,2024-07-28 23:33:34,2198,98
1380,How research interest eye. Eat other explain some. A if good part five today plan.,2,2024-03-26 13:26:53,4369,56
1381,Sometimes face drive response action skin place. Create man traditional per.,3,2024-07-23 20:12:53,5046,118
1382,Charge them challenge yet simply recognize. Give kitchen quality road international several all. Garden after enough expert contain save peace out. Save story expert far act exactly happy serious.,3,2024-06-20 07:42:50,8502,178
1383,Apply total sound service from. Onto carry trip member bed decision consumer talk.,1,2024-09-18 15:34:13,1362,196
1384,Visit history half respond. Become big sister opportunity dog hold per protect.,1,2024-06-15 22:13:53,3289,135
1385,Great alone impact rise you through Democrat end. Itself others main event budget never. During she professor would think away your.,5,2024-09-28 14:11:53,1685,3
1386,Piece board not grow fight imagine culture. Test argue great there consider turn lay. Yet into bag.,3,2024-07-16 17:08:28,2871,111
1387,Able protect service business. Do his mother truth building. Woman tree sea year job. Plan research discussion view debate range care.,2,2024-05-28 09:04:54,3205,57
1388,Store friend during enter. Stop address radio president high fight little.,5,2024-09-01 10:40:59,7256,93
1389,Key goal under food score free black. Street year military investment central positive though poor.,5,2024-08-11 05:24:22,1985,162
1390,Popular professor force fact eye. Hot national western weight case write take.,5,2024-08-14 16:27:03,974,1
1391,Sit marriage hospital factor though life. Child trip ground expert. Go edge similar now. Character stuff public common dream.,5,2024-06-29 21:23:56,8290,178
1392,During age market two. Region old condition final. Story while break manage professor require process.,3,2024-09-22 13:36:15,4670,89
1393,Fine room simple quite world treatment process. Enjoy join rise.,4,2024-04-27 01:48:48,2041,65
1394,Feel adult any describe. Science blue finish good near identify. Pass adult young job whether act.,2,2024-01-29 08:02:42,4297,175
1395,Anyone land same week mother bed. Option process with step air. Car buy start game crime stay what.,3,2024-02-20 05:28:29,2542,170
1396,Listen worker show. Father oil race few consider.,4,2024-08-20 05:19:04,8898,23
1397,Think special debate difference manage issue type guy. Take base environmental would those allow we. Meet minute want. Economic build board accept environmental pass international.,3,2024-09-30 07:54:48,2722,87
1398,Than yet understand partner. Use eight include attorney law great of. Week issue music administration.,2,2024-05-10 22:14:44,5557,94
1399,Sell police live buy.,4,2024-08-08 06:00:50,8751,37
1400,Night director final friend drop especially. Speech drop because onto.,5,2024-07-02 00:29:31,3028,23
1401,Image same low movement herself fine down. Federal my want break present leg.,2,2024-09-27 10:47:44,8504,78
1402,Well task detail again like detail single. Board pay per explain stay plan.,5,2024-03-20 18:49:34,9221,137
1403,Wait certainly decision raise line. Anyone red development two.,2,2024-10-08 07:48:26,6087,12
1404,Them team game. Usually decide tend often.,4,2024-04-24 15:36:41,5106,47
1405,Building early bed type worker house build receive. Production generation ago particularly. Cultural mention above miss may.,1,2024-02-15 04:50:31,8540,187
1406,Develop everything military sister result Democrat grow. Continue second situation forward character magazine a.,1,2024-07-22 01:12:25,4664,147
1407,Recognize drug knowledge be option each common. Letter town recent ball.,1,2024-02-14 18:43:38,2828,102
1408,Data good dog thing thought leg single. Win manage a figure. Major voice wish probably air until successful.,1,2024-05-30 23:09:24,9059,152
1409,Focus them business bring herself. Full actually reason can pay study just.,5,2024-02-06 21:41:30,7887,5
1410,Car claim former foot its point. Assume catch ahead character team admit drug.,2,2024-05-05 08:33:33,4409,91
1411,Increase professor add ask worry stop control.,3,2024-03-24 15:14:55,6785,185
1412,Apply agent write even. Various project rule meet generation lead crime.,1,2024-04-27 07:14:53,1837,74
1413,Wind stop happy prove reduce few. Their school can this let. Ask energy southern.,3,2024-01-25 18:40:15,4422,184
1414,Beautiful century production become near. Process argue than your soldier visit woman.,2,2024-09-01 21:44:56,758,164
1415,Provide laugh determine deep thought check partner. Board plant oil team almost agency.,3,2024-01-10 16:40:35,2383,189
1416,Member miss piece heart career crime with town. Something hit style blood. Information involve increase can.,2,2024-07-13 17:53:31,7732,163
1417,Discussion her artist agent quite south might. Somebody book defense.,4,2024-05-30 02:37:19,9435,71
1418,Into media race just my. Success old quality safe raise. Color kid left apply.,4,2024-03-28 21:55:57,8432,27
1419,Money do field heavy seem include. May one consider people particularly.,2,2024-03-12 06:40:53,6250,28
1420,Operation big surface sure Congress with media. Each child event color. Want hope so car store listen.,3,2024-01-08 11:40:18,6363,70
1421,Hundred might director cup claim. Gun right rock course plan. Can level high research food. Never cause make mother.,3,2024-02-01 07:30:40,8359,133
1422,Which treatment first send. Understand hope operation traditional.,2,2024-01-12 00:56:34,6065,169
1423,Mr economy material daughter girl. Public why newspaper democratic nearly collection.,3,2024-03-30 06:03:28,3802,47
1424,All off general next law. Science just open once lead western finish. Serve commercial pick detail million half.,4,2024-02-22 21:38:14,909,52
1425,Commercial weight pattern size. Especially stand energy somebody right tell activity out.,5,2024-04-30 04:17:13,6009,173
1426,Degree song ground among live television. There lawyer itself make open.,1,2024-08-09 09:41:37,4106,81
1427,Dog national I television day. Discussion environment leg eat mind lay we look. Build about their house.,1,2024-08-18 01:58:26,1766,155
1428,War all rather blood out seven check. Politics she among lot industry end.,3,2024-08-23 04:05:17,3632,174
1429,Position book than style form down way. Item style successful fund yourself money. Then son while father point room.,4,2024-09-14 18:28:31,1044,138
1430,Sometimes doctor industry under. Pm western high stage season push brother necessary. Strategy style event full dream strong generation. Reach best expert will.,2,2024-02-18 07:43:44,8024,43
