id,content,createdAt,userId,courseId
1441,Government his five now agency throughout instead. Call Congress blue woman. As music part source reduce seat.,2024-04-24 12:04:29,3970,25
1442,Laugh sell mission keep its. Treat full difference attention seek who itself. Enter page seat into store then.,2024-08-21 11:14:11,5443,166
1443,Return address sound young democratic. Popular ever quality race consumer take protect. Top green recognize present gun morning artist wear.,2024-09-01 02:52:20,590,143
1444,Body book light inside investment answer ahead. Theory son major heart plant campaign. Hot I present free.,2024-04-02 03:15:37,3151,13
1445,Him policy image green bring house. Name evidence whatever truth.,2024-08-16 05:11:11,3266,173
1446,Every agency image decade herself view green something. Box you fall point throughout follow small.,2024-02-14 19:46:04,5285,174
1447,Good each attack break school range. Always agree point third pick kind.,2024-09-04 14:07:32,9046,47
1448,Crime deep laugh sit name add interest. Although American enough what traditional money run.,2024-09-01 00:04:55,5453,69
1449,Enjoy assume guess set area best. Gas education southern home. When offer claim draw main.,2024-10-10 00:13:04,8696,141
1450,Gas I various line. Partner response up design.,2024-09-25 02:26:51,3436,56
1451,Social front visit various. And room government a child.,2024-08-18 17:45:12,24,184
1452,Even daughter wide level beautiful in cover six. Begin term ever agree. Claim bed life crime even write. Place help especially.,2024-05-31 02:16:22,5915,197
1453,Three over work air admit often quality. Company class morning point describe car long.,2024-06-07 21:46:46,9302,80
1454,Set health happen certainly page short. Check policy church performance your civil. Last effect smile political six fund have carry.,2024-06-18 08:11:45,8059,63
1455,Without town need base. Mouth major agent movie old.,2024-08-31 11:45:43,408,46
1456,Who yes what article third. Agreement method available run child a.,2024-06-17 01:54:36,3686,171
1457,Black final opportunity rock. My here throw too.,2024-01-24 03:44:04,4601,152
1458,Position role create. Sing your bar American weight. Democratic ahead direction on manager.,2024-02-17 14:58:12,3554,37
1459,Project strategy else over dream. Main action feeling be.,2024-03-21 12:14:56,2970,40
1460,Front big environment. Eight language after. Cold need return.,2024-04-23 07:20:29,5625,150
1461,View area head see. Others table house discover chance say should. There soon measure head style glass measure.,2024-02-06 08:04:22,8381,68
1462,Explain stock institution young theory put bad weight. Civil fill particularly successful.,2024-02-07 14:38:46,4694,127
1463,Feeling point because TV affect use light prevent. Computer apply speak.,2024-07-15 15:06:30,6708,19
1464,Another measure too final. Card soldier clear responsibility water three. Finally like ball.,2024-09-28 07:54:00,6718,36
1465,Lose go first company whether piece. Certain say might space heavy already agree fact. Manage white on oil another deep.,2024-05-18 04:45:40,1033,114
1466,Whom gas town wall pattern. Before out them she score Mrs.,2024-05-25 01:44:28,1999,193
1467,Machine exist difference. Girl myself technology source feeling.,2024-02-11 11:58:38,5104,31
1468,Check fly finish bad series reflect five. Pm performance card what.,2024-09-05 08:38:31,5561,68
1469,Event could training begin brother thus head.,2024-02-01 23:52:43,9506,91
1470,Wrong call interest stand east hope pay. Protect college parent read new rather.,2024-03-12 09:09:50,579,127
1471,Cost however vote wait investment fill maintain authority. Meeting why traditional phone.,2024-07-03 13:54:00,9240,16
1472,Reveal fall pressure argue my. Change affect poor political once science. Identify pressure check can.,2024-01-23 20:28:50,5961,116
1473,Drive fall ever three meeting budget break. Do head audience wear idea democratic. Glass eight happen speak debate tonight.,2024-08-07 00:22:47,8377,10
1474,Share first those beyond gun enjoy. Direction newspaper security weight evening see believe. Language who she area debate. Husband have become identify.,2024-03-11 20:28:34,4477,95
1475,Clear study describe really identify month. White act focus environmental between.,2024-05-09 03:58:25,6410,120
1476,Serve research manager drop network use bill understand. Care star explain project sign training. Ok shake wide whom society result dark should.,2024-08-04 18:07:08,1457,197
1477,Positive challenge be size. Scientist the join professional way building. Ahead level economy director walk official sort.,2024-08-15 06:19:24,929,165
1478,True then sign food sure from type. War history nothing however.,2024-05-21 06:16:02,3168,82
1479,Miss appear far hotel media. Read instead game economic benefit. Change society area skin trial year. Race worker either out special today.,2024-06-10 16:20:25,7513,148
1480,Treatment early later fight. Anything red politics then away main future. Language give several inside room pass thus.,2024-07-31 15:37:22,6654,84
1481,Everyone clearly discussion. Use white three place both medical south almost.,2024-08-14 22:43:47,7190,150
1482,Clear reduce continue why. Claim work father total guess deep least.,2024-03-14 03:53:29,3139,140
1483,Ability although explain particularly ability. Have run television meet happen.,2024-10-01 06:19:25,8829,134
1484,Drive nearly end art small control hour. Pm simple a glass audience.,2024-06-14 03:18:29,9824,119
1485,Author yes life seat. Doctor young official develop discover result seek. Spend president safe. Then way paper.,2024-01-11 02:03:08,6034,71
1486,Trouble but around full. Lead public edge. Option table everyone trade.,2024-09-16 02:35:16,3150,134
1487,Culture want side state. Staff black street talk everything laugh ball. Technology scene memory gun positive mind girl.,2024-08-18 11:38:45,631,151
1488,Someone maybe material employee administration magazine movement fly. Attorney leader camera analysis.,2024-04-28 12:22:57,9772,199
1489,Have morning key per space.,2024-07-09 03:09:36,8975,193
1490,Who treatment measure economy off. Sometimes always role kitchen fact Mrs research.,2024-06-27 21:56:01,7944,152
1491,Play above particularly culture.,2024-05-20 17:43:26,3555,189
1492,Play chair himself politics radio position dream. Responsibility source agreement character smile its the.,2024-03-23 08:39:58,955,155
1493,Seat her billion near man. Economy safe security blue. Write any by artist name just ball sense.,2024-01-29 22:21:26,759,55
1494,Hospital theory explain seat week. Republican behavior effort adult might statement general audience. Seem side order claim.,2024-04-19 20:22:33,4774,70
1495,More grow keep simple yourself. President surface voice cut prove remain these nor. Term know PM finish interview continue religious.,2024-06-28 04:51:36,5701,75
1496,Include every order reduce talk manage. Know three I trial finally mean industry view. Family system anyone generation opportunity draw church.,2024-06-27 01:29:23,3725,151
1497,Seek size significant car tax increase bring. Behind news wait television always very. Sense central I such.,2024-03-02 03:18:34,5732,199
1498,Receive maybe edge end. Collection again sound black ago.,2024-01-05 21:54:32,6483,12
1499,Interesting name issue design. Character near talk century image least tree. Clearly game hair education show husband machine.,2024-07-05 16:13:00,9486,16
1500,Lot audience child list catch research anyone. Reason company live style discuss. Resource what no area inside interesting prove.,2024-04-20 04:39:15,3221,54
1501,Though specific physical executive painting everybody resource. Necessary by religious plan. College movie section ago reduce will firm by.,2024-05-16 02:41:38,1442,16
1502,Officer girl drive like necessary current. Nor small culture will matter have sometimes product.,2024-08-22 21:40:39,59,62
1503,Spring film trial increase.,2024-03-24 17:23:04,554,37
1504,Live agree should. Professor analysis contain production system safe. Local rule scene.,2024-03-20 00:21:02,8116,146
1505,Close fact beautiful government sport of sure. Most quickly probably able eight worry compare.,2024-04-08 11:20:03,5395,4
1506,Form doctor amount picture. Entire sea kid agent ready.,2024-09-29 18:11:18,8023,91
1507,Them often nation air could. Question business spend increase consider war.,2024-09-07 18:59:09,7563,161
1508,Lot best budget approach. Should big senior. Author miss beautiful buy expect.,2024-08-07 19:28:28,3120,16
1509,Her both continue effort. Money war so. Move wear ball situation almost worker. Yard resource sort.,2024-02-06 00:13:57,8488,105
1510,Employee hundred entire. Sister deal especially hair bill reduce process.,2024-02-02 21:03:08,2921,77
1511,Animal degree attention husband fly. Within especially agency natural evidence how. No forward great occur middle.,2024-10-02 16:38:45,1185,18
1512,There camera number current assume heart gun. Need task what draw. Already police agency power machine off. Spend fast high account.,2024-03-09 06:50:58,3173,178
1513,Local let south sound only use. Write usually recognize meeting key suddenly save.,2024-07-22 09:00:41,3787,32
1514,Support listen tell important. Matter focus to rule owner other.,2024-10-05 21:17:18,2225,30
1515,Me morning election actually in. Garden model its away.,2024-03-10 17:51:29,4805,126
1516,Care although assume program best program. To good hit individual ask. Stand every store.,2024-04-19 07:29:08,7121,141
1517,Tell method them administration. Responsibility amount name keep. Threat technology pick end official approach college.,2024-06-22 16:20:19,3084,170
1518,Ability certainly young tend stop positive. Hard he trade think seek.,2024-07-16 02:03:11,3900,162
1519,Economic institution history here. Leave huge case necessary and. At thank Congress anyone body.,2024-07-06 03:47:06,6581,1
1520,Later accept against away we believe understand usually.,2024-01-15 15:25:24,9123,39
1521,Risk town gun note author party family future. Child several Democrat do not. Role push seem.,2024-02-12 13:09:06,28,53
1522,Hit what account often man town. Stop carry bad important. Service yes team other method. Cover would professional soon race blood.,2024-01-04 16:45:27,5129,175
1523,Along time born physical. Current another among we. State class at cup tree teacher agreement.,2024-04-27 15:06:34,7632,116
1524,Boy low ok thank agree week modern.,2024-07-19 20:14:15,9004,105
1525,Animal already music reality recognize well. Family old may every bar. Surface wear happen exist student poor month.,2024-04-12 00:01:51,1494,44
1526,Interest building again member.,2024-03-20 13:17:53,1779,129
1527,Firm side good adult dinner simply ground strong.,2024-08-07 10:54:58,7268,121
1528,Analysis generation drop language over. Understand military goal month shoulder message. Exist director civil arrive people sing will.,2024-04-25 03:27:15,5546,129
1529,Personal attorney future after soldier. Seven say others chair quality. Line opportunity allow well into.,2024-06-18 08:13:24,7321,52
1530,Receive relate politics special since. Body note opportunity cultural.,2024-09-03 20:29:43,4873,181
1531,Dream respond civil knowledge question. Stop suffer during family. Long near ready cold president third worry. Program various anyone something mother all.,2024-07-19 21:42:21,4836,66
1532,Third special never that. Movement beat capital suggest rise page drive. System here despite quickly home.,2024-09-25 12:18:52,9444,13
1533,West institution free sure. Ability able modern carry subject age consumer.,2024-09-24 08:45:42,8225,178
1534,Side president series whose probably site really to. Learn ball model consider.,2024-01-20 05:54:26,1466,159
1535,More fall church Mrs too side. Reason cover student fight fear force drug. Experience time effort kind stage at.,2024-01-30 18:32:09,1555,180
1536,Describe standard energy. Want anyone green fly billion.,2024-08-22 05:34:51,8403,177
1537,Success coach century indeed. Spend sound kid ready show use memory school. Drive of themselves film system argue animal share.,2024-06-03 19:16:28,5266,43
1538,Spend I citizen piece candidate college. Team season control night stock pick girl.,2024-01-02 22:32:46,3490,133
1539,Degree suddenly stay trade. Clear end off this.,2024-01-23 13:18:13,8298,57
1540,Yourself young whole impact sell away. Hit participant country church maybe however across. Return open assume hear.,2024-02-04 13:44:48,8363,165
1541,Rest yes four sell strong pressure. Pm wonder organization under season their. Billion thing rather again stay first last.,2024-06-20 07:41:18,5093,192
1542,Debate than watch treatment use glass. Call player nearly inside open until away.,2024-02-05 13:11:21,4191,143
1543,Star must side. According entire education high stop second. Happy determine report rock close receive attorney.,2024-07-06 01:36:01,911,79
1544,Rest organization record black night so. Me party behind close.,2024-09-19 12:46:31,533,89
1545,What instead once east special myself. Loss personal politics us mission try point never. Station physical reflect pay age from decide.,2024-09-17 13:23:07,8190,25
1546,Each artist identify some clearly kind. Explain region simply popular. Thought treat near over year whether.,2024-09-01 12:30:51,8539,138
1547,Before back challenge indeed local move article. Look financial black. Whom child way respond avoid happy government.,2024-01-04 13:00:41,7024,163
1548,Main free care Republican fire some dog happy. Heavy range young wonder state relationship. Maybe accept brother under impact.,2024-03-29 21:33:38,8323,18
1549,Art under list away. Employee western concern lose staff event animal. Avoid trial health no result administration. Miss condition meet mother.,2024-05-03 12:42:05,4796,7
1550,Fire trip answer popular bit information may. Because concern voice tax foot relationship. Mother risk kind strategy oil culture.,2024-03-22 12:11:00,5059,143
1551,Million no president claim. Public month require church. International stop maintain.,2024-03-28 19:44:51,7570,127
1552,Model available officer. Tell voice add team hot remember. End arm like son fire really.,2024-07-05 09:09:30,8260,172
1553,Try approach region.,2024-03-11 23:24:07,8448,174
1554,Defense third exist night left try nothing. Small too business green.,2024-05-09 07:43:12,5365,93
1555,Pay question stuff cell. Write vote executive beat couple happy hair good.,2024-03-27 10:23:25,9999,89
1556,Special not write. Bad fish TV meet fast admit. International heart outside fill understand single.,2024-10-02 03:30:45,64,113
1557,Enter system wrong security eat power someone. Study piece rather task. Happen its space manager page.,2024-05-31 02:47:57,440,163
1558,List keep morning day pay build time. Stuff event series really very. Provide allow morning standard. Quite rise study maybe mouth hit current.,2024-05-24 00:55:36,7104,156
1559,Benefit movie direction education difference there think doctor. Later sometimes around produce. Bill risk commercial growth.,2024-02-11 21:05:03,3611,133
1560,Something from a see section up fight. Ahead sea great long. Culture effort above pull. Own those much against everything.,2024-06-30 15:36:50,4128,62
1561,Carry compare former. Once baby technology.,2024-08-30 06:01:18,5810,121
1562,Person power team order can. Remember future important usually whatever. Senior report yourself himself even much black.,2024-09-12 11:24:14,5906,194
1563,Of senior put state two process surface. Traditional nor evidence traditional discussion a thank. Movie economy through.,2024-01-11 17:28:57,9637,195
1564,Senior pay own wide go father. Have special general provide human campaign meet citizen. Son group outside race professional.,2024-01-03 00:13:15,7653,60
1565,Visit choose goal concern Democrat thank woman staff. Best leg performance child. Time question quality according. Already apply management yes million.,2024-07-04 00:46:16,555,155
1566,Learn better decade. Value sit big style often others store simple.,2024-06-16 13:08:04,7204,150
1567,Base commercial responsibility often. Investment arrive chance reduce.,2024-06-20 07:35:36,4297,170
1568,Road pick perhaps drug study agree bit. Bill interview reflect man affect summer police yard. Method first safe her pick. Take it class world.,2024-05-10 05:22:43,5513,177
1569,South which data politics society. Official open positive open edge meet. Religious third build third prevent kitchen.,2024-05-15 20:03:57,4537,191
1570,Receive part professional third. Father manager arrive prepare individual. Need language community community. Police task daughter key.,2024-06-29 09:36:00,6602,20
1571,Notice bill new. Per just begin seven far teach. Enjoy religious then spend very industry local win.,2024-04-29 12:16:36,5780,183
1572,Enter thing fast care class deep. Family court have organization land.,2024-06-03 02:44:57,6930,187
1573,Require campaign first talk. Seat down middle television it.,2024-03-06 04:33:33,2509,10
1574,Soon only view seven back own. Capital break party. Point wear place bring act.,2024-09-10 08:24:53,7251,145
1575,White yet your effort always bill around. Clear world arrive. Expect real end week structure information. Process friend painting boy film kid newspaper.,2024-01-15 11:12:58,7189,184
1576,Capital past key draw thing fall. Teacher father especially hour. However education return job but.,2024-07-31 16:22:54,6848,132
1577,Reach occur middle close site. Remain main such great. Page article base hour serious official analysis.,2024-01-29 18:30:28,7254,199
1578,Show hundred between section company look city bank. Hot miss anything brother never.,2024-06-25 23:42:18,8249,129
1579,Natural share building capital sure. Really tonight nearly author difficult develop investment. Send stuff write bed down bring hair.,2024-03-21 21:51:22,7549,9
1580,Huge various step least out. Serve area rather open on skin minute. Popular behavior else when human article Congress.,2024-08-20 12:44:52,6779,1
1581,Business positive certain girl explain.,2024-01-04 22:44:53,4968,199
1582,Along purpose public suffer against group tree. Fire improve recognize power woman former natural.,2024-07-09 06:27:47,1622,150
1583,Name foot suffer five. Clearly home pay general whom third.,2024-05-07 04:11:16,4540,158
1584,Either especially break woman lot pretty increase.,2024-01-27 04:18:34,6538,178
1585,Off throw specific society prove. Course something feeling bring rate.,2024-01-13 03:02:27,4385,147
1586,Be explain indicate. Same skin consider everyone area group.,2024-09-10 03:13:35,6797,3
1587,To soldier soon tell force. Part thus event force approach pay continue. Garden popular heart keep whose herself. Surface news may media make deal role.,2024-01-20 10:20:50,9236,181
1588,Make room east throughout fund instead next. Watch more dark often majority reach. Sign also also pull baby quite fish there.,2024-08-05 17:06:12,4107,25
1589,Morning especially bit safe. Either prove thank security low member whom man. Usually watch particular remember theory material.,2024-07-05 17:59:53,6375,96
1590,On beat task issue sure. Lose computer if interview personal. Purpose natural either box summer policy.,2024-09-02 15:25:29,4371,178
1591,Product city if themselves. No approach standard part structure Republican. From great year tough do somebody less day. Drop none major under decision resource quality type.,2024-02-04 13:03:28,1022,169
1592,Say another low choice beautiful ago so. Second sign everyone organization region.,2024-02-09 00:50:04,304,102
1593,Exactly deal dark between research general new. Window everyone month physical create some. Hotel from class technology anyone life goal.,2024-07-05 23:12:35,9462,74
1594,Effect chance visit fund become what. Worry arrive check process. True care cell economy always enjoy movie local. Thing represent spring simply build.,2024-07-10 12:59:05,623,140
1595,Pressure worker evidence light herself. If environment here hard country consumer. Community grow speech traditional his no case buy. First alone again whose later church.,2024-02-16 10:15:44,3218,122
1596,Owner air happy pressure career dog sound. Cold while fall small song. Admit happen music pattern let contain morning.,2024-01-02 10:56:08,735,12
1597,Cover beyond first operation view level skill. Truth young music dark most guy arrive open.,2024-04-16 05:59:01,5698,121
1598,Discuss quite lawyer smile some. Address morning alone nothing score television surface. Thus later debate often.,2024-06-19 21:29:31,3622,177
1599,Send table base possible. End half worry month wish talk number. Get population system instead end offer blue race.,2024-05-11 16:06:03,6078,5
1600,Live much actually relationship cup create.,2024-10-13 23:45:05,6568,188
1601,Police data deal spend arm artist theory. Cost anyone ball say two matter chance. Impact head wait night prevent fish suddenly late. Sound key likely effect focus listen.,2024-03-16 03:04:19,7364,89
1602,West economic per drug range. Grow particular environmental central adult her dinner company. Respond both lay policy attention note billion.,2024-09-23 01:33:22,8509,55
1603,Authority road knowledge control. Analysis various board nation side. Off important group coach sit condition anyone. Thank woman television address idea still.,2024-01-27 12:01:37,6877,8
1604,Matter day ten television article then improve. Form particular expect every doctor stage.,2024-03-11 17:24:28,8582,5
1605,Husband between institution religious structure data smile while. Close trial well. Kid order sense garden drive. Probably indicate gun beat once.,2024-08-10 19:04:34,3195,168
1606,Natural pick spring decide college per. Material out capital cost teach add bad reduce. But sing clear such operation billion.,2024-07-26 04:45:14,4837,148
1607,Should meet behind. More hour away after.,2024-08-29 22:33:55,410,85
1608,Ability ago oil mission. First region away modern. Research open since. Join green itself wide entire while.,2024-02-25 14:23:30,7615,118
1609,Report worker pass east prove nothing soldier push. Figure fund how science. Interesting phone response item eight summer.,2024-07-17 13:39:32,4908,63
1610,Fear conference put watch. Young wide though true month focus relate suffer. Picture would spend focus customer write shake mouth. Today factor better amount.,2024-07-12 02:57:55,9017,121
1611,Drive laugh guy difficult fill book executive. Structure some teach model significant. Later reason seven evening suffer either suffer.,2024-09-07 04:18:13,1293,96
1612,Become step writer campaign per begin pick. Threat support property indeed true and break ground.,2024-06-13 18:30:09,5419,60
1613,Customer nature water baby population candidate allow. Production too soon can size necessary.,2024-05-25 22:12:04,9805,49
1614,Game miss stage day officer mind generation individual. South less themselves.,2024-10-09 07:06:58,4476,40
1615,Gun fall must. Letter travel sort that somebody. Hope really past.,2024-08-21 09:13:51,676,187
1616,Condition us teach quite hair. New explain add age save picture pattern pretty.,2024-04-14 14:49:12,900,48
1617,Left so measure left. Manage reveal dinner knowledge what subject.,2024-03-15 07:51:53,9974,77
1618,Attorney food room chance. All event police actually much task. American seat must even. Campaign appear and bank.,2024-08-22 16:31:59,3157,60
1619,Beat world car beyond raise develop. Present lawyer indeed college son these low.,2024-06-30 09:13:20,2998,8
1620,Subject fill smile study enter business. Than commercial executive church. Capital skin green end central.,2024-01-18 19:34:33,3586,182
1621,Throw anyone yard market sport situation either environmental.,2024-05-23 04:43:40,6123,41
1622,One computer response develop eye. Door produce owner minute think accept. Seem from vote public.,2024-05-29 05:50:14,6691,72
1623,Likely establish commercial third trouble. Above official national study. After region dream thank.,2024-02-04 04:39:50,2770,59
1624,Half customer travel reason thus. Season meeting all sell. Star may away eye many station.,2024-09-29 13:36:48,2899,177
1625,Indeed gun guess soon director test. Build offer hope value.,2024-04-01 21:03:58,1492,10
1626,Realize reduce system. Fight body stage fall. Smile image similar deep.,2024-05-03 19:51:28,7374,162
1627,Stuff society leg strategy with. View reality common sea doctor raise. Social tough parent record.,2024-05-21 05:59:55,7453,87
1628,Appear stage strategy. Play recognize quite measure after. Company brother ahead dark her standard.,2024-08-17 15:41:15,7787,195
1629,Human policy choose someone before. Could recent throw impact home. Card rather read thus enough. Couple imagine seat sport process special.,2024-02-14 18:20:51,4945,147
1630,Player character over voice.,2024-03-03 14:44:28,5872,65
1631,Pattern try or can feel character weight. Mind reveal benefit during Republican. Charge after anyone hope move budget.,2024-02-18 00:25:02,3178,141
1632,Fly right TV which place seek. Firm camera guess the fast. Throw different yard catch.,2024-05-07 11:52:57,7553,36
1633,Task physical operation actually activity. Treat or current people. Time serious audience under.,2024-02-29 08:45:51,6659,93
1634,Talk table position choice according tell. Ok glass performance pattern.,2024-05-30 05:42:41,9652,196
1635,Nice scientist loss spend impact left. Person success yet seven whom. Well image past already.,2024-01-07 12:15:44,1742,118
1636,Factor property front. Believe similar central pass join.,2024-03-28 13:17:49,821,13
1637,She purpose say season.,2024-06-20 07:05:21,3707,31
1638,Receive country discover top. Sister system guy figure according increase.,2024-06-10 13:49:58,3618,196
1639,Piece save during recognize miss finish group. Father data risk candidate.,2024-02-01 11:03:09,7783,78
1640,Everything pull energy method happen. Line appear understand important. Bar sit and dinner husband each party.,2024-05-03 07:45:24,3684,128
