id,content,createdAt,userId,courseId
1,Class political with rise though decision. Couple amount whose wait.,2024-07-25 12:05:31,1819,79
2,Game behavior later professional reason officer. Third he else likely attention prevent. For billion thousand property citizen large ahead. Role system whole establish long similar reveal might.,2024-04-19 18:16:05,6512,195
3,Environment know notice back. Consider full world defense skin relate. Quickly reason cultural tough watch.,2024-04-09 18:41:03,2935,4
4,Paper it back reach which serious less. Mother beat ball. Significant practice how be.,2024-08-27 05:26:52,1834,81
5,Significant pretty full social least. Name somebody question guess improve thing price.,2024-10-05 02:42:56,7123,23
6,Think wrong though speak. Draw painting if involve top behind second.,2024-08-17 07:13:48,4332,100
7,Particular fine practice already summer. Big hold window amount order young rate clearly.,2024-02-20 06:31:18,7560,117
8,Road office lead teach others. Who down weight sit employee.,2024-06-30 00:12:34,3120,75
9,Every class contain close. Little between role claim into. Democratic join consumer administration according impact full.,2024-08-15 09:55:35,4727,14
10,Skin member man create. Take step professor report.,2024-07-14 00:07:58,8614,23
11,Call concern if cover base feeling. Near cost physical process huge science.,2024-04-09 02:10:33,9573,27
12,Unit agent positive law heart wind. Big however model including.,2024-06-27 04:09:34,6748,81
13,Range truth among green actually. Success leave report. College fall rock call recent war own.,2024-09-08 02:13:13,1591,116
14,Sell both long less audience strong her. Marriage sit when senior meet.,2024-08-07 06:24:06,147,31
15,End capital bed book. Bar degree while population clear. Admit throughout your.,2024-06-06 03:45:51,4974,27
16,Professor help leader with. A field magazine manage leave watch.,2024-08-21 09:01:05,2166,180
17,Tree however third six once surface. Available conference if accept data. Professor course until media huge together.,2024-07-31 01:36:08,9649,74
18,Site social government. Matter news almost tend.,2024-04-17 06:15:30,6543,122
19,Include mouth left shake carry. Several instead impact sense feeling treatment six.,2024-05-04 18:39:54,2956,96
20,Walk break party give method friend source. Impact build carry lose sit day enter. Newspaper indeed make system drug others.,2024-01-19 15:24:53,314,132
21,Guy person hotel. Certain after thus mouth hard suggest. Song natural leader return education strong compare.,2024-09-02 19:29:03,3238,196
22,Social government beyond design start final mission represent. Quality goal run give direction charge get. Opportunity I look hospital seat turn.,2024-04-06 14:15:28,393,51
23,Science writer theory allow institution hand house. Decide different word. Letter need argue office. Across clear bad bar oil.,2024-05-12 04:43:04,7903,19
24,Pass another low move yourself could.,2024-01-21 02:35:14,2024,5
25,Store boy budget save own. Service treat myself wish.,2024-06-22 15:46:31,190,191
26,Girl give history. Marriage child upon eight clearly leave.,2024-09-25 09:00:17,6323,132
27,Center weight peace simply become study television. Change inside board police important kitchen.,2024-02-14 08:32:19,1677,153
28,Really prepare job adult fund agree now miss. Value avoid return form religious usually.,2024-06-13 04:56:17,2756,182
29,Bar year traditional contain here test. Whole room some.,2024-02-18 14:22:38,1312,157
30,Ask speak pressure man suffer down thank. Threat message entire wide. Word safe ok half decision support draw human.,2024-08-08 04:05:22,1955,3
31,Congress build hold senior. Really girl success toward represent political. Sound various prove the couple bar.,2024-10-10 19:52:41,1025,61
32,Me pull station decide. Improve bring kitchen fill certain rule option.,2024-04-13 20:08:49,4068,164
33,Box join prevent memory. Expect behavior fund executive service yeah. Evidence share course imagine market finally. Agent product listen beyond.,2024-02-03 09:26:31,6358,40
34,Citizen media mother five against tree political. Her continue military. Join paper people fight long fine. Major strong whom.,2024-03-24 18:20:07,5847,116
35,Ever sea would represent ahead under inside option. Simple often recently sure increase any minute.,2024-01-10 13:57:16,1036,180
36,Any region summer court pass first. Value discover dog suffer age friend. Experience radio drop government send themselves.,2024-03-10 08:35:54,5314,73
37,Sit always computer although picture fish perform. Drug seat ask.,2024-09-05 19:54:57,4327,190
38,By run cultural instead reason. Fall data produce food. Race blue provide nice society reflect.,2024-09-16 19:03:11,6567,149
39,Might know Republican dream worker man individual between. Simple only against authority.,2024-04-13 10:20:28,2270,94
40,Lawyer thousand clearly safe employee film. Alone member year work ready.,2024-10-05 15:46:37,4280,25
41,Marriage action he travel. Out human available benefit tend store teacher.,2024-09-14 03:01:02,8219,97
42,Democratic class something test country lay. Can continue security human.,2024-06-23 12:43:14,4307,41
43,My from draw improve. Strategy bill success happy bank parent can.,2024-08-05 16:16:50,6477,135
44,Tree style everyone. Them pretty billion let full trial girl.,2024-05-17 13:57:09,1707,85
45,Throughout read whole listen million. Consider subject owner while. Successful go price.,2024-07-22 01:07:17,753,82
46,Bar according road attorney. Crime crime single news the.,2024-03-27 04:20:02,6703,66
47,Positive technology discuss building decide region culture. Fund really plant cell. Simple manager push must include specific range American.,2024-01-11 10:37:12,9528,110
48,Against hold medical read training. Color pay prove need can.,2024-07-20 22:05:48,2530,113
49,Reflect become out benefit movement or join. Effort road just group picture. Along share east ever outside recognize might.,2024-03-16 22:08:31,5469,30
50,Off order need plan feel environment check during. Believe probably mission.,2024-07-04 08:09:22,9690,46
51,Provide road age suddenly challenge often. Blood accept remain center. Ever find he education.,2024-01-20 11:23:06,2774,111
52,Word gas plan seem grow student stage. Realize policy present window clearly. Summer PM these stop compare.,2024-07-28 10:58:56,1834,120
53,Bar window appear mind long program. Food consider actually project month type. Reach tax make million nothing wonder.,2024-07-16 00:50:18,7202,99
54,Easy back account heavy. Apply traditional report.,2024-05-07 19:58:07,6336,25
55,Series opportunity finally third meeting feel if require. Or probably wear share. Part weight woman fish picture thing.,2024-01-15 14:36:02,436,51
56,Require teach among front anything. Tax address perhaps available teacher effort would.,2024-09-05 22:36:33,91,75
57,Read add marriage bring alone purpose. Film lay focus hear.,2024-09-17 14:05:27,6498,169
58,Yard suffer fly himself exactly. Information job home it.,2024-07-06 03:23:25,1598,12
59,Receive or employee dark everyone during real. Practice eight significant green have. Data choose gun heart hotel join enjoy.,2024-09-01 00:07:57,6301,193
60,Figure west better degree admit black. Worry true her whatever likely contain reduce mention.,2024-06-17 06:30:00,5366,100
61,Create support end. Mission single create research thousand feel. Husband friend since born all financial foreign.,2024-05-25 08:10:23,4331,31
62,Congress western special school kind operation. West employee tonight life boy wind bag place. Stock skin Mr civil simply during. Strong station individual.,2024-08-07 20:19:03,8117,88
63,Star character feel player cold operation well. Participant notice energy cost would.,2024-03-25 19:52:30,137,11
64,Less view apply into off sign character. Language much group campaign establish as.,2024-07-26 04:43:35,2902,11
65,Manage main matter cause military course community executive. Above side mind instead audience successful single. Piece wall and put official.,2024-09-23 12:57:53,3579,13
66,Investment week call discuss pass. Hope unit from man establish.,2024-08-27 20:47:29,300,189
67,Heart significant boy. Study none anything increase term. Program general tend.,2024-07-26 03:50:35,2358,26
68,Fear difficult character turn eight. Hope sound contain clear store.,2024-07-10 05:02:59,4096,4
69,Sit visit magazine but. Sell particularly next early speak off voice.,2024-10-07 07:49:54,4292,187
70,Rise billion everything. Phone fear turn against try force walk. Bill standard say word mention try after.,2024-01-10 19:41:45,2341,7
71,Beat technology majority mention. Wide general since wide dinner together national.,2024-05-05 16:33:44,8353,17
72,Remember town result great free wide. For worry bring worry. Sing sport debate my pressure I together peace.,2024-07-30 08:54:22,8007,167
73,Set bit I by. Organization nice range direction best must piece.,2024-04-18 21:19:19,5168,114
74,Military western way property discover. Ability wish or something card popular own. Religious give today movement right. Almost a no interview raise wish.,2024-09-08 02:47:47,9732,200
75,Picture bit suddenly he. Future beat explain leader. Ability back popular surface.,2024-09-18 02:14:04,3847,200
76,Population option former program foreign enter.,2024-08-12 23:42:01,9914,15
77,Act agreement statement product. Begin I religious car. Long situation edge officer political quite. Bag until whatever short theory fund five financial.,2024-05-21 18:19:47,6503,52
78,Its operation office. Only sign lot run should whose on.,2024-06-21 10:37:13,329,171
79,Third nothing music certain decade girl spring without. Us mind return him responsibility option nothing. Draw hundred feel lose get significant tree seek.,2024-06-16 01:45:20,6738,23
80,Similar choose himself. Art find travel wonder.,2024-04-18 15:11:15,2903,60
81,Right on husband notice teach. Message husband three head available fly interview.,2024-06-04 23:20:56,7174,165
82,Its soon hundred place he resource. Week activity tax together often. Special most debate situation certain.,2024-06-08 08:51:41,7968,87
83,Two bill a hair. Really peace great live by adult fish which. Place way difficult.,2024-09-02 08:09:34,6301,33
84,Employee head boy behind more morning. Pay worry sea her direction interview. Return from measure world however example force.,2024-05-07 18:05:42,5488,20
85,No our eat ever soldier east just. Stock should walk know enough than.,2024-10-14 07:27:53,1614,176
86,Reduce happy cold provide. Cup place medical when television first capital. Direction guy around room list by late.,2024-03-10 10:49:43,5956,173
87,Happen become where play. Allow compare along moment early create. Page fire sometimes believe on enough.,2024-09-02 12:33:00,1106,37
88,Knowledge song produce remain. Instead him statement painting strategy.,2024-03-16 22:56:01,8142,43
89,Situation like maintain down. Important really my generation various store look.,2024-05-16 11:49:59,924,74
90,Meet phone item cold leg suffer. Middle city mother along. Option art by those property.,2024-03-13 07:43:57,1419,95
91,Order note speech increase. Never sit big fight anyone recognize bar. Visit certainly plan action father.,2024-04-15 15:07:24,5611,138
92,Feeling point wish of. Beyond arrive city crime. Agree apply concern event focus remain unit.,2024-09-23 21:25:55,451,133
93,Trip cultural participant science politics recently. Image local democratic Congress pass available hotel.,2024-08-08 11:51:48,4210,54
94,Be dinner decide official mother. Later let to it evening project.,2024-07-12 01:44:52,4014,104
95,Nature process another send term reduce decide. Wrong present however left fact middle election. Attack public government real commercial.,2024-02-08 20:43:49,7103,138
96,City put chance. Anything white federal reason food.,2024-07-13 20:09:39,3925,68
97,These get sound rather second. Camera thus where. Law manage view through. Them trouble outside instead.,2024-04-14 14:29:18,2548,43
98,Institution force senior skin at better. Up fish PM sure price ability south.,2024-01-20 13:49:06,8156,125
99,Election idea country two beyond cut. Despite television far clear garden under let.,2024-08-18 08:52:27,4584,59
100,Peace follow sound night able attention edge. Office have beat commercial senior campaign effect hospital. Rather owner coach determine.,2024-09-16 09:33:20,6364,87
101,Partner gas involve sound wall education little. Live lawyer call we effort fish stop.,2024-02-12 05:32:23,3927,185
102,Available kind yet series where statement. Draw seat unit physical. Themselves husband bag member stand general.,2024-08-25 09:47:57,3345,93
103,Present environment miss. Less dream and television loss.,2024-08-09 05:14:21,5326,130
104,Card organization large message always here. After community particular rate case much.,2024-04-30 11:51:04,7255,150
105,Team animal great reduce study situation voice. Help food dark season chance would.,2024-09-20 02:13:20,8861,64
106,Line establish even probably. Clearly born and spend hair officer foot.,2024-03-06 19:48:11,3707,47
107,Vote imagine pattern interview toward. Too statement how.,2024-05-08 20:59:29,712,99
108,Else every box blue edge simply. Mission ready everything worker expect father drop win.,2024-03-14 10:16:45,9097,109
109,Visit day fly wish. Foot create player high.,2024-09-18 10:24:40,9099,168
110,Fine arm various writer summer. Job economic eight important.,2024-06-02 22:01:49,2240,21
111,Age relate add we consider many. Threat political important inside spend score. Adult firm garden well.,2024-03-18 02:06:54,1871,192
112,Increase professor best according yard consumer letter. Half suggest front kind scientist.,2024-10-09 23:16:07,440,112
113,Safe memory particularly culture often than. Professor growth fall performance continue grow interview.,2024-02-24 21:47:56,9912,41
114,Former public season realize another age my. Buy scientist finally significant action agree prevent.,2024-05-22 14:12:34,5664,185
115,Most perform this thank never federal. Appear determine growth ground reality. Reveal course manager against white notice.,2024-07-11 11:32:01,6518,177
116,Price decide both face listen. Agent increase kitchen.,2024-03-10 01:06:59,7302,45
117,Approach information public everyone cell section note. Travel music gun who.,2024-08-29 03:57:32,1086,181
118,Information success machine boy sit firm give maintain. Weight quite sure film bring. Friend student across field data.,2024-08-17 10:15:47,6389,84
119,Book their catch education director message. Professional really talk discussion lose lawyer.,2024-01-02 11:13:10,9661,1
120,Develop respond image rule market morning. Young both lawyer study week.,2024-06-12 15:51:20,5380,79
121,Often that tax get. Both bring fire growth nearly life not.,2024-09-09 15:19:03,7525,151
122,Nearly participant like play visit particular. Church lead party lead perhaps. Up miss recently think development.,2024-05-27 16:24:32,3469,82
123,Keep paper entire whole month. Inside early opportunity week maybe argue. Ok performance yeah talk good wait six.,2024-06-13 03:18:16,6567,20
124,Like through station girl issue size. Mother bit international cell explain level.,2024-10-03 11:33:49,8357,167
125,Best five number best analysis source respond. Dog remain rest paper. Protect case material three.,2024-02-23 06:18:50,1820,189
126,Specific beat push military state hard soldier. Discuss TV north from little.,2024-08-31 15:22:36,7166,117
127,Eye economic where before air sound. Activity believe pass sell analysis any rather. Prove too or. Federal order generation son find.,2024-09-20 07:02:10,1122,187
128,Expect base after girl sport. Have else new eat pay player drop. Individual common card must listen size.,2024-08-24 16:50:18,5906,181
129,Idea Democrat all stage million test.,2024-05-05 07:35:15,9941,185
130,Language nearly remain spend standard. Believe dark interest history stay most.,2024-01-12 12:52:48,1713,68
131,Represent activity summer if government traditional. Technology year material drive red sister man.,2024-04-26 13:06:24,3052,68
132,Social off speech lawyer will end know. Student even firm.,2024-04-07 12:14:09,6527,193
133,West machine member hope. History field civil bar young. Source difficult clearly common process interview early.,2024-09-10 07:29:39,1293,126
134,Commercial six art likely. It conference song fish example almost position section.,2024-09-28 16:22:51,2729,162
135,Fly yet field low. Best summer individual fight along student. Quickly interesting view.,2024-09-04 22:41:34,9644,36
136,Room people bill stop. Final this baby or protect. Economy allow much.,2024-07-15 12:15:00,2399,77
137,Success accept way upon kitchen lawyer daughter. Trouble design environment suggest political garden.,2024-09-02 16:05:01,3571,87
138,Hotel agreement on west industry lot.,2024-02-26 00:15:58,4317,158
139,Claim real crime which smile. International truth everything not painting without.,2024-07-09 18:09:32,7187,144
140,While research law artist modern tonight hand. State simple city partner include. Total him popular give.,2024-03-21 22:45:30,3836,80
141,Program few especially very great among. Poor dream law evening. Between hour against mind really start bring.,2024-03-10 22:28:31,3638,119
142,Protect here cup much story son. Easy several edge cover. Military marriage large apply reason seek.,2024-04-10 17:14:38,7936,64
143,Discussion room worker board. Billion word great young. Most quickly agreement hour civil. Allow suddenly else adult.,2024-09-29 08:48:41,3131,147
144,Face final everybody raise. Government dog rise so read lay daughter.,2024-01-05 01:43:46,7107,198
145,Among responsibility man choose tax care what officer. Card federal he simple increase here.,2024-06-10 07:20:25,8848,96
146,Himself glass my study late wife over age. Technology mean ok draw shoulder head. Recognize usually stage detail party create.,2024-03-09 05:53:29,3725,184
147,Order improve in yeah far. Resource past section market soldier church. Floor science set girl.,2024-01-11 09:41:17,5124,33
148,Available subject cup including course. Window program we book style past. Foreign happy also station ball hotel remember. Piece east explain guess clear prove prepare.,2024-02-11 06:01:56,5446,171
149,Ask happen cup. Same Mrs black our raise.,2024-04-28 02:56:27,50,105
150,Partner amount debate level later he finally relate.,2024-09-14 18:05:06,3463,186
151,Air less sister laugh raise address improve leave. Recognize by me word theory why either.,2024-06-27 14:01:02,4371,59
152,They responsibility certain our already give capital far. Upon history inside near for. Energy specific direction year cultural great. Page reflect lawyer whether country tax protect century.,2024-03-30 21:41:52,6637,136
153,Yes spend standard. Clear treatment south no nor score college. Finally participant give item think country.,2024-09-12 16:59:48,1947,85
154,Hold somebody whose enter no line ask.,2024-02-19 13:35:13,8791,98
155,Economy eat situation my true available. Enter serious space against during. Building everything for describe suddenly table.,2024-05-19 10:08:47,908,2
156,Board several open color agency. Low customer front firm. Particularly also information second this.,2024-04-26 12:37:38,4977,200
157,Business people company present. Analysis friend miss more able successful want party.,2024-10-04 01:52:23,9952,80
158,Notice mission must weight cover analysis. By difficult allow check.,2024-01-08 15:12:18,3365,100
159,Past major political seek. Whose ability job remain once another. Time those with gas former color.,2024-01-30 23:41:51,3941,98
160,Themselves rather foreign particularly member. Way old experience blue PM and tend.,2024-02-02 01:27:53,1622,43
161,Which either be letter international quality. On make year significant research tonight edge.,2024-08-11 03:59:25,9003,54
162,After prevent performance they also performance off. Voice no specific service knowledge century.,2024-03-12 20:49:13,7242,149
163,Sea structure note explain. Face near soldier class hold edge environmental.,2024-10-03 17:58:00,3376,22
164,Environmental car nation listen article usually. Life maintain civil focus represent computer upon know. Itself way ask quite soon.,2024-07-29 07:33:36,9595,7
165,Rest put politics plan. Glass life serve deep type drop future.,2024-07-29 06:34:51,5752,93
166,Here any money very big power. Later key public talk suggest. Wind heart cause.,2024-08-19 14:21:19,3919,67
167,Reveal yourself age meet. Then police no.,2024-09-12 03:07:15,7546,188
168,Particularly born whatever cut. Memory interview determine although. Material Democrat town. Party cause them society many member.,2024-02-20 19:51:27,8775,71
169,Generation government those argue part find. Likely until total accept recent.,2024-07-05 03:49:45,5136,153
170,Although as know east wish. Billion first act expect high. Relationship father any expect star hold ten front.,2024-05-19 07:05:12,8227,31
171,Policy believe trouble leader. Series none same along indicate.,2024-03-04 00:37:25,1851,41
172,Few his drop prevent. Whatever relate toward us be scene so. Direction left day close herself memory.,2024-04-29 17:25:48,8214,24
173,Window along claim third explain practice great politics. Through into western old clearly baby. Want apply born field least after.,2024-08-01 14:09:19,740,113
174,Far big nearly point detail child. Body voice set benefit sometimes dog outside green.,2024-03-21 02:11:53,3618,84
175,Discussion ever hour significant strategy star. Receive to interesting.,2024-05-17 05:36:31,379,72
176,Theory include face bed agent letter. Remain enter meet central.,2024-06-10 03:52:38,5576,193
177,Maintain customer scene could. Culture trouble usually language opportunity model speech.,2024-08-08 20:10:33,4120,32
178,Decade style might rise. Difference pressure fill. Three stuff remain question.,2024-04-21 03:07:04,3979,135
179,Commercial meeting at institution term. Amount form to example. Degree area quickly up value fast produce fast. Ten kid two edge art us avoid.,2024-05-01 05:32:05,4114,11
180,Already allow beat whatever act perform. Include language writer truth draw real smile grow. Animal pick back outside develop.,2024-08-27 02:34:24,9508,51
181,Respond family four wear way happy. Prevent adult science mother.,2024-08-17 13:35:44,4465,188
182,Child color hotel picture attorney commercial. Mrs fine time cause face above forget.,2024-08-09 09:38:34,8298,121
183,Official writer news church purpose. Great hospital use do. Factor example learn property own shake.,2024-01-26 23:58:00,2822,64
184,Man college perhaps less. Bit one way operation three.,2024-02-14 06:58:04,3730,190
185,Short expert tonight on. Base past civil west simple many.,2024-04-05 23:17:44,7896,67
186,Operation recent evidence center left believe majority need.,2024-09-02 04:43:42,1297,66
187,Almost table war amount white. And theory his power particular capital ground. Or itself then friend ready.,2024-06-11 06:38:16,4964,176
188,Teach standard spring specific he hair. Head no work should character popular.,2024-01-15 04:59:13,4074,165
189,Near peace plant thus society sport once. Great maybe eye house close line successful challenge. Understand image the else recently.,2024-01-06 18:00:09,4783,139
190,Camera soldier notice partner finish. Dream range raise police road help. Together especially remain charge.,2024-02-24 07:24:07,3405,131
191,Six include go foot different. None push understand worker lay which mind.,2024-05-22 00:03:54,2336,80
192,East person guy majority include identify. Skill general though let. Certainly suggest entire moment measure order evidence likely.,2024-09-05 12:58:39,2646,40
193,Major structure continue recently catch idea opportunity. Such tell me election whose member reflect. Provide never much dream line. Continue Mrs my or cold say above north.,2024-05-22 22:03:40,6854,105
194,Ever subject option foreign officer. Possible than statement mission understand simple marriage act. Lose money bad require decision receive. Other certainly nature garden standard write.,2024-08-26 17:15:13,9678,83
195,Marriage child admit who even recently. Tree agree hotel share my very.,2024-09-29 19:27:34,871,57
196,State participant anyone film voice likely not.,2024-08-22 16:24:11,4290,30
197,Think fill per consider. Training eat job page maintain certain.,2024-08-21 21:25:26,4631,88
198,Letter human six order for. Design speech hold.,2024-01-20 01:52:43,7368,49
199,Song similar ball become talk. Light focus study war.,2024-07-05 21:02:09,8553,22
200,Lose quickly there both go style. Necessary friend similar interesting into size bag.,2024-07-15 05:13:05,4135,120
201,Pull attorney under surface way. Shoulder back street low. Property student discussion also cause.,2024-06-06 21:00:52,8550,42
202,You shake yes during item coach finally. Shake fight interest issue instead attack.,2024-02-07 15:17:03,2870,197
203,First political compare life trouble respond. Ever open could beat.,2024-06-29 07:15:41,309,67
204,Break realize design care important animal scientist any.,2024-09-10 15:32:29,904,83
205,Old manager less accept data listen around. Deep consider quickly cultural make out hotel face. Experience choose rate late forward avoid. Speak field threat north.,2024-02-23 14:01:23,8606,62
206,Movie or sister the anything kid. Discover continue person our change travel hand. While garden smile plant.,2024-01-30 05:01:17,9171,110
207,After television that center. Item fear weight second. Opportunity four professor owner truth personal five. Either national middle choice already.,2024-01-25 07:01:38,9514,33
208,Include personal newspaper professor.,2024-05-03 06:58:47,552,19
209,Behind recognize meet number sit group check occur. Time write return himself.,2024-02-22 22:40:03,7826,73
